Level	Rule Name	Subject	Property	Value
ERROR	missing_label	FOODON:00003537	rdfs:label	
ERROR	missing_label	FOODON:00003742	rdfs:label	
ERROR	missing_label	FOODON:00003907	rdfs:label	
ERROR	missing_label	FOODON:03520521	rdfs:label	
ERROR	multiple_labels	FOODON:00002577	rdfs:label	grape wine by region@en
ERROR	multiple_labels	FOODON:00002577	rdfs:label	wine by region@en
ERROR	multiple_labels	FOODON:00003902	rdfs:label	river tamarind pod@en
ERROR	multiple_labels	FOODON:00003902	rdfs:label	river tamarind pod (whole)@en
ERROR	multiple_labels	FOODON:00004056	rdfs:label	Spanish wine production framework@en
ERROR	multiple_labels	FOODON:00004056	rdfs:label	spanish wine production framework@en
ERROR	multiple_labels	FOODON:00004065	rdfs:label	Table Wine (deprecated EU standard)@en
ERROR	multiple_labels	FOODON:00004065	rdfs:label	table wine (EU standard)@en
ERROR	multiple_labels	FOODON:00004070	rdfs:label	conventional maceration@en
ERROR	multiple_labels	FOODON:00004070	rdfs:label	convetional maceration@en
ERROR	multiple_labels	FOODON:03301050	rdfs:label	lemon-flavored beverage mix (dry)@en
ERROR	multiple_labels	FOODON:03301050	rdfs:label	lemon-flavored beverage mix dry@en
ERROR	multiple_labels	FOODON:03301607	rdfs:label	konjacu tuber (whole)@en
ERROR	multiple_labels	FOODON:03301607	rdfs:label	konjacu tuber (whole, raw)@en
ERROR	multiple_labels	FOODON:03301639	rdfs:label	low alcoholic beverage (3-5% alcohol)@en
ERROR	multiple_labels	FOODON:03301639	rdfs:label	low alcoholic beverage, 3-5% alcohol@en
ERROR	multiple_labels	FOODON:03301721	rdfs:label	prune (whole)@en
ERROR	multiple_labels	FOODON:03301721	rdfs:label	prune (whole, dehydrated)@en
ERROR	multiple_labels	FOODON:03301869	rdfs:label	fruit-flavored beverage (carbonated)@en
ERROR	multiple_labels	FOODON:03301869	rdfs:label	fruit-flavored beverage carbonated@en
ERROR	multiple_labels	FOODON:03302073	rdfs:label	mullet roe (salted, air-dried)@en
ERROR	multiple_labels	FOODON:03302073	rdfs:label	mullet roe salted air-dried@en
ERROR	multiple_labels	FOODON:03302145	rdfs:label	chicken-flavored bouillon (powdered or granulated)@en
ERROR	multiple_labels	FOODON:03302145	rdfs:label	chicken-flavored bouillon powdered or granulated@en
ERROR	multiple_labels	FOODON:03302204	rdfs:label	honey cake (sliced, reduced-salt)@en
ERROR	multiple_labels	FOODON:03302204	rdfs:label	honey cake sliced reduced-salt@en
ERROR	multiple_labels	FOODON:03302280	rdfs:label	grape drink (carbonated, artificially flavored and colored, vitamin-fortified)@en
ERROR	multiple_labels	FOODON:03302280	rdfs:label	grape drink carbonated artificially flavored and colored vitamin-fortified@en
ERROR	multiple_labels	FOODON:03302388	rdfs:label	fruit juice drink (vitamin-fortified, noncarbonated)@en
ERROR	multiple_labels	FOODON:03302388	rdfs:label	fruit juice drink vitamin-fortified noncarbonated@en
ERROR	multiple_labels	FOODON:03302391	rdfs:label	soybean soda (vitamin-fortified, carbonated)@en
ERROR	multiple_labels	FOODON:03302391	rdfs:label	soybean soda vitamin-fortified carbonated@en
ERROR	multiple_labels	FOODON:03302403	rdfs:label	beverage (carbonated, amino acid-fortified)@en
ERROR	multiple_labels	FOODON:03302403	rdfs:label	beverage carbonated amino acid-fortified@en
ERROR	multiple_labels	FOODON:03302418	rdfs:label	lemon-flavored beverage base (naturally and artificially sweetened)@en
ERROR	multiple_labels	FOODON:03302418	rdfs:label	lemon-flavored beverage base naturally and artificially sweetened@en
ERROR	multiple_labels	FOODON:03302534	rdfs:label	roll (butter-flavored, enriched)@en
ERROR	multiple_labels	FOODON:03302534	rdfs:label	roll butter-flavored enriched@en
ERROR	multiple_labels	FOODON:03302661	rdfs:label	pepper-type carbonated beverage (decaffeinated)@en
ERROR	multiple_labels	FOODON:03302661	rdfs:label	pepper-type carbonated beverage decaffeinated@en
ERROR	multiple_labels	FOODON:03302662	rdfs:label	coffee-type beverage base (caffeine-free)@en
ERROR	multiple_labels	FOODON:03302662	rdfs:label	coffee-type beverage base, caffeine-free@en
ERROR	multiple_labels	FOODON:03302673	rdfs:label	pasteurized process cheese (artificially colored, spray-dried)@en
ERROR	multiple_labels	FOODON:03302673	rdfs:label	pasteurized process cheese artificially colored spray-dried@en
ERROR	multiple_labels	FOODON:03302677	rdfs:label	cream of wheat (artificially caramel malt-flavored, dry, instant)@en
ERROR	multiple_labels	FOODON:03302677	rdfs:label	cream of wheat artificially caramel malt-flavored dry instant@en
ERROR	multiple_labels	FOODON:03302702	rdfs:label	bread (high fiber, reduced-calorie)@en
ERROR	multiple_labels	FOODON:03302702	rdfs:label	bread high fiber reduced-calorie@en
ERROR	multiple_labels	FOODON:03302917	rdfs:label	chocolate-flavored beverage mix (dry, instant)@en
ERROR	multiple_labels	FOODON:03302917	rdfs:label	chocolate-flavored beverage mix dry instant@en
ERROR	multiple_labels	FOODON:03302986	rdfs:label	longhorn cheddar cheese (semisoft, part-skim)@en
ERROR	multiple_labels	FOODON:03302986	rdfs:label	longhorn cheddar cheese semisoft part-skim@en
ERROR	multiple_labels	FOODON:03303160	rdfs:label	tomato sauce (italian-style, canned)@en
ERROR	multiple_labels	FOODON:03303160	rdfs:label	tomato sauce italian-style canned@en
ERROR	multiple_labels	FOODON:03303437	rdfs:label	spaghetti in tomato sauce (italian-style, canned)@en
ERROR	multiple_labels	FOODON:03303437	rdfs:label	spaghetti in tomato sauce italian-style canned@en
ERROR	multiple_labels	FOODON:03303579	rdfs:label	mozzarella cheese (low-moisture, part-skim)@en
ERROR	multiple_labels	FOODON:03303579	rdfs:label	mozzarella cheese low-moisture part-skim@en
ERROR	multiple_labels	FOODON:03303591	rdfs:label	chocolate-coated banana (frozen)@en
ERROR	multiple_labels	FOODON:03303591	rdfs:label	chocolate-coated banana frozen@en
ERROR	multiple_labels	FOODON:03303676	rdfs:label	st. paulin cheese@en
ERROR	multiple_labels	FOODON:03303676	rdfs:label	st. paulin cheese (food product)@en
ERROR	multiple_labels	FOODON:03303693	rdfs:label	cheese (2% milk)@en
ERROR	multiple_labels	FOODON:03303693	rdfs:label	cheese 2% milk@en
ERROR	multiple_labels	FOODON:03303698	rdfs:label	cold-pack cheese (alcohol added)@en
ERROR	multiple_labels	FOODON:03303698	rdfs:label	cold-pack cheese alcohol added@en
ERROR	multiple_labels	FOODON:03303716	rdfs:label	beverage (carbonated, vitamin- and mineral-fortified)@en
ERROR	multiple_labels	FOODON:03303716	rdfs:label	beverage carbonated vitamin- and mineral-fortified@en
ERROR	multiple_labels	FOODON:03303796	rdfs:label	pastille (artificially fruit-flavored, dietetic)@en
ERROR	multiple_labels	FOODON:03303796	rdfs:label	pastille artificially fruit-flavored dietetic@en
ERROR	multiple_labels	FOODON:03303923	rdfs:label	green bean (french-style, frozen)@en
ERROR	multiple_labels	FOODON:03303923	rdfs:label	green bean french-style frozen@en
ERROR	multiple_labels	FOODON:03304180	rdfs:label	sea herring (boneless, hard-smoked)@en
ERROR	multiple_labels	FOODON:03304180	rdfs:label	sea herring boneless hard-smoked@en
ERROR	multiple_labels	FOODON:03304315	rdfs:label	confectioner's sugar@en
ERROR	multiple_labels	FOODON:03304315	rdfs:label	confectioner's sugar (food product)@en
ERROR	multiple_labels	FOODON:03304419	rdfs:label	gelatin dessert mix (low sodium, sugar-free)@en
ERROR	multiple_labels	FOODON:03304419	rdfs:label	gelatin dessert mix low sodium sugar-free@en
ERROR	multiple_labels	FOODON:03304424	rdfs:label	tomato catsup (low-sodium, sugar-free)@en
ERROR	multiple_labels	FOODON:03304424	rdfs:label	tomato catsup low-sodium sugar-free@en
ERROR	multiple_labels	FOODON:03304435	rdfs:label	beef (steak, freeze-dried)@en
ERROR	multiple_labels	FOODON:03304435	rdfs:label	beef steak freeze-dried@en
ERROR	multiple_labels	FOODON:03304558	rdfs:label	brewers' grain flavor (natural)@en
ERROR	multiple_labels	FOODON:03304558	rdfs:label	brewers' grain flavor natural@en
ERROR	multiple_labels	FOODON:03304744	rdfs:label	meat tenderizer (salt-free, frozen)@en
ERROR	multiple_labels	FOODON:03304744	rdfs:label	meat tenderizer salt-free frozen@en
ERROR	multiple_labels	FOODON:03305088	rdfs:label	lemon-flavored beverage (carbonated)@en
ERROR	multiple_labels	FOODON:03305088	rdfs:label	lemon-flavored beverage carbonated@en
ERROR	multiple_labels	FOODON:03305110	rdfs:label	candy (effervescent, artificially-colored)@en
ERROR	multiple_labels	FOODON:03305110	rdfs:label	candy effervescent artificially-colored@en
ERROR	multiple_labels	FOODON:03305300	rdfs:label	fruit juice beverage (diluted, noncarbonated)@en
ERROR	multiple_labels	FOODON:03305300	rdfs:label	fruit juice diluted noncarbonated@en
ERROR	multiple_labels	FOODON:03305308	rdfs:label	chicken-flavored gravy mix (dry)@en
ERROR	multiple_labels	FOODON:03305308	rdfs:label	chicken-flavored gravy mix dry@en
ERROR	multiple_labels	FOODON:03305337	rdfs:label	gravy mix (italian-style, dry)@en
ERROR	multiple_labels	FOODON:03305337	rdfs:label	gravy mix italian-style dry@en
ERROR	multiple_labels	FOODON:03305450	rdfs:label	imitation rainbow ice (lemon- and cherry-flavored, frozen)@en
ERROR	multiple_labels	FOODON:03305450	rdfs:label	imitation rainbow ice lemon- and cherry-flavored frozen@en
ERROR	multiple_labels	FOODON:03305468	rdfs:label	grapefruit drink (cherry-flavored, artificially colored)@en
ERROR	multiple_labels	FOODON:03305468	rdfs:label	grapefruit drink cherry-flavored artificially colored@en
ERROR	multiple_labels	FOODON:03305481	rdfs:label	grape beverage (less than 0.5% alcohol)@en
ERROR	multiple_labels	FOODON:03305481	rdfs:label	grape beverage less than 0.5% alcohol@en
ERROR	multiple_labels	FOODON:03305563	rdfs:label	beverage (carbonated, guarana-flavored)@en
ERROR	multiple_labels	FOODON:03305563	rdfs:label	beverage carbonated guarana-flavored@en
ERROR	multiple_labels	FOODON:03305568	rdfs:label	bean (ham-flavored, dried)@en
ERROR	multiple_labels	FOODON:03305568	rdfs:label	bean ham-flavored dried@en
ERROR	multiple_labels	FOODON:03305694	rdfs:label	pollock (mashed, scallop-flavored)@en
ERROR	multiple_labels	FOODON:03305694	rdfs:label	pollock mashed scallop-flavored@en
ERROR	multiple_labels	FOODON:03305695	rdfs:label	pollock (mashed, crab-flavored)@en
ERROR	multiple_labels	FOODON:03305695	rdfs:label	pollock mashed crab-flavored@en
ERROR	multiple_labels	FOODON:03305744	rdfs:label	grape juice base sweetened powdered@en
ERROR	multiple_labels	FOODON:03305744	rdfs:label	grape juice beverage base (sweetened, powdered)@en
ERROR	multiple_labels	FOODON:03305871	rdfs:label	calf's foot gelatin@en
ERROR	multiple_labels	FOODON:03305871	rdfs:label	calf's foot gelatin (food product)@en
ERROR	multiple_labels	FOODON:03305887	rdfs:label	imitation mint-flavored jelly (artificially colored)@en
ERROR	multiple_labels	FOODON:03305887	rdfs:label	imitation mint-flavored jelly artificially colored@en
ERROR	multiple_labels	FOODON:03306024	rdfs:label	beverage (fruit-flavored, noncarbonated)@en
ERROR	multiple_labels	FOODON:03306024	rdfs:label	beverage fruit-flavored noncarbonated@en
ERROR	multiple_labels	FOODON:03306049	rdfs:label	pineapple jelly (mint-flavored, artificially colored)@en
ERROR	multiple_labels	FOODON:03306049	rdfs:label	pineapple jelly mint-flavored artificially colored@en
ERROR	multiple_labels	FOODON:03306070	rdfs:label	apple jelly (mint-flavored, artificially colored)@en
ERROR	multiple_labels	FOODON:03306070	rdfs:label	apple jelly mint-flavored artificially colored@en
ERROR	multiple_labels	FOODON:03306071	rdfs:label	imitation mint-flavored jelly (mint leaves added)@en
ERROR	multiple_labels	FOODON:03306071	rdfs:label	imitation mint-flavored jelly mint leaves added@en
ERROR	multiple_labels	FOODON:03306072	rdfs:label	apple jelly (mint-flavored, with green pepper)@en
ERROR	multiple_labels	FOODON:03306072	rdfs:label	apple jelly mint-flavored with green pepper@en
ERROR	multiple_labels	FOODON:03306175	rdfs:label	fruit-flavored punch (canned)@en
ERROR	multiple_labels	FOODON:03306175	rdfs:label	fruit-flavored punch canned@en
ERROR	multiple_labels	FOODON:03306322	rdfs:label	apple jelly (mint-flavored, mint leaves added)@en
ERROR	multiple_labels	FOODON:03306322	rdfs:label	apple jelly mint-flavored mint leaves added@en
ERROR	multiple_labels	FOODON:03306327	rdfs:label	oyster (pacific, powdered, freeze-dried)@en
ERROR	multiple_labels	FOODON:03306327	rdfs:label	oyster pacific powdered freeze-dried@en
ERROR	multiple_labels	FOODON:03306382	rdfs:label	orange marmalade (cherry-flavored, with maraschino cherries)@en
ERROR	multiple_labels	FOODON:03306382	rdfs:label	orange marmalade cherry-flavored with maraschino cherries@en
ERROR	multiple_labels	FOODON:03306419	rdfs:label	beef-flavored gravy mix (dry, instant)@en
ERROR	multiple_labels	FOODON:03306419	rdfs:label	beef-flavored gravy mix dry instant@en
ERROR	multiple_labels	FOODON:03306567	rdfs:label	beef-flavored bouillon seasoning and broth (instant)@en
ERROR	multiple_labels	FOODON:03306567	rdfs:label	beef-flavored bouillon seasoning and broth instant@en
ERROR	multiple_labels	FOODON:03306574	rdfs:label	chocolate-flavored drink (instant)@en
ERROR	multiple_labels	FOODON:03306574	rdfs:label	chocolate-flavored drink instant@en
ERROR	multiple_labels	FOODON:03306933	rdfs:label	paprika pepper (mild-flavored, pickled)@en
ERROR	multiple_labels	FOODON:03306933	rdfs:label	paprika pepper mild-flavored pickled@en
ERROR	multiple_labels	FOODON:03307017	rdfs:label	peach (cherry-flavored, canned)@en
ERROR	multiple_labels	FOODON:03307017	rdfs:label	peach cherry-flavored canned@en
ERROR	multiple_labels	FOODON:03307018	rdfs:label	peach (coconut-flavored, canned)@en
ERROR	multiple_labels	FOODON:03307018	rdfs:label	peach coconut-flavored canned@en
ERROR	multiple_labels	FOODON:03307024	rdfs:label	plantain chip (green, deep-fried)@en
ERROR	multiple_labels	FOODON:03307024	rdfs:label	plantain chip green deep-fried@en
ERROR	multiple_labels	FOODON:03307050	rdfs:label	pilchard (chunk-style, packed in water, canned)@en
ERROR	multiple_labels	FOODON:03307050	rdfs:label	pilchard chunk-style packed in water canned@en
ERROR	multiple_labels	FOODON:03307077	rdfs:label	chicken-flavored consomme mix (dry, instant)@en
ERROR	multiple_labels	FOODON:03307077	rdfs:label	chicken-flavored consomme mix, dry, instant@en
ERROR	multiple_labels	FOODON:03307136	rdfs:label	green olive (in brine)@en
ERROR	multiple_labels	FOODON:03307136	rdfs:label	olive green in brine@en
ERROR	multiple_labels	FOODON:03307624	rdfs:label	pear juice (concentrated, acid-reduced)@en
ERROR	multiple_labels	FOODON:03307624	rdfs:label	pear juice concentrated acid-reduced@en
ERROR	multiple_labels	FOODON:03307859	rdfs:label	iced tea mix (grape-flavored, sugar added)@en
ERROR	multiple_labels	FOODON:03307859	rdfs:label	iced tea mix grape-flavored sugar added@en
ERROR	multiple_labels	FOODON:03308487	rdfs:label	pepper sweet strips canned@en
ERROR	multiple_labels	FOODON:03308487	rdfs:label	sweet pepper (strips, canned)@en
ERROR	multiple_labels	FOODON:03309016	rdfs:label	albacore (solid-pack, canned)@en
ERROR	multiple_labels	FOODON:03309016	rdfs:label	albacore solid-pack canned@en
ERROR	multiple_labels	FOODON:03309122	rdfs:label	ray's bream (raw)@en
ERROR	multiple_labels	FOODON:03309122	rdfs:label	ray's bream raw@en
ERROR	multiple_labels	FOODON:03309123	rdfs:label	ray's bream (canned)@en
ERROR	multiple_labels	FOODON:03309123	rdfs:label	ray's bream canned@en
ERROR	multiple_labels	FOODON:03309373	rdfs:label	fat substitute made from egg white and/or milk protein@en
ERROR	multiple_labels	FOODON:03309373	rdfs:label	fat substitute made from egg white and/or milk protein (food product)@en
ERROR	multiple_labels	FOODON:03309386	rdfs:label	pudding (sugar-free, instant)@en
ERROR	multiple_labels	FOODON:03309386	rdfs:label	pudding sugar-free instant@en
ERROR	multiple_labels	FOODON:03309562	rdfs:label	frankfurter on a stick (batter-dipped, cooked)@en
ERROR	multiple_labels	FOODON:03309562	rdfs:label	frankfurter on a stick batter-dipped cooked@en
ERROR	multiple_labels	FOODON:03530087	rdfs:label	food product appelation framework@en
ERROR	multiple_labels	FOODON:03530087	rdfs:label	food product appellation framework@en
ERROR	deprecated_boolean_datatype	FOODON:00002123	owl:deprecated	true@en
ERROR	deprecated_boolean_datatype	FOODON:00002136	owl:deprecated	true@en
ERROR	deprecated_boolean_datatype	FOODON:03302410	owl:deprecated	true@en
ERROR	deprecated_boolean_datatype	FOODON:03306040	owl:deprecated	http://www.langual.org/langual_thesaurus.asp?termid=H0754^^http://www.w3.org/2001/XMLSchema#anyURI
ERROR	deprecated_boolean_datatype	FOODON:03310661	owl:deprecated	true@en
ERROR	deprecated_boolean_datatype	FOODON:03315027	owl:deprecated	http://www.langual.org/langual_thesaurus.asp?termid=H0108^^http://www.w3.org/2001/XMLSchema#anyURI
ERROR	deprecated_boolean_datatype	FOODON:03315285	owl:deprecated	true@en
ERROR	deprecated_boolean_datatype	FOODON:03315561	owl:deprecated	true@en
ERROR	deprecated_boolean_datatype	FOODON:03317365	owl:deprecated	true@en
ERROR	deprecated_boolean_datatype	FOODON:03470104	owl:deprecated	^^http://www.w3.org/2001/XMLSchema#anyURI
ERROR	duplicate_label	FOODON:03412825	rdfs:label	wild grape plant@en
ERROR	duplicate_label	FOODON:03414821	rdfs:label	wild grape plant@en
ERROR	duplicate_label	FOODON:03411750	rdfs:label	tree fern plant@en
ERROR	duplicate_label	FOODON:03414698	rdfs:label	tree fern plant@en
ERROR	duplicate_label	FOODON:00002424	rdfs:label	roquefort cheese@en
ERROR	duplicate_label	FOODON:03302997	rdfs:label	roquefort cheese@en
ERROR	duplicate_label	FOODON:03490364	rdfs:label	polyester container@en
ERROR	duplicate_label	FOODON:03490417	rdfs:label	polyester container@en
ERROR	duplicate_label	FOODON:03490359	rdfs:label	polyamide container@en
ERROR	duplicate_label	FOODON:03490416	rdfs:label	polyamide container@en
ERROR	duplicate_label	FOODON:03301007	rdfs:label	chocolate candy@en
