Level	Rule Name	Subject	Property	Value
WARN	annotation_whitespace	VO:0000031	IAO:0000115	A vaccine for active immunization to prevent invasive disease caused by Neisseria meningitidis serogroups C and Y and Haemophilus influenzae type b. MENHIBRIX is approved for use in children 6 weeks of age through 18 months of age. 
WARN	annotation_whitespace	VO:0000035	IAO:0000115	a vaccinia virus vaccine that is a freeze-dried calf lymph smallpox vaccine, specifically, Dryvax is a live-virus preparation of vaccinia prepared from calf lymph. 
WARN	annotation_whitespace	VO:0000069	IAO:0000115	A Measles-Mumps-Rubella vaccine that is live attenuated and manufactured by Merck & Co, Inc. 
WARN	annotation_whitespace	VO:0000070	IAO:0000115	A Measles-Mumps vaccine that is manufactured by Merck and used for human. 
WARN	annotation_whitespace	VO:0000079	IAO:0000115	an influenza vaccine that is similar to Fluzone but has high dose. 
WARN	annotation_whitespace	VO:0000091	IAO:0000115	A Measles-Mumps-Rubella-Vericella vaccine that is live and manufactured by Merck & Co, Inc. 
WARN	annotation_whitespace	VO:0000137	IAO:0000115	a vaccine role that indicates the vaccine being a combination vaccine. 
WARN	annotation_whitespace	VO:0000145	IAO:0000115	a vaccine component role that inheres in a recombinant vaccine vector as a vaccine component. The combination of a recombinant vaccine vector and a heterogenous protective antigen(s) inserted inside the vector for a recombinant vector vaccine. 
WARN	annotation_whitespace	VO:0000147	IAO:0000115	an adjuvant role that inheres in a vaccine component which is added as part of a vaccine and induces enhanced adaptive immune response to the vaccine antigen. 
WARN	annotation_whitespace	VO:0000154	IAO:0000115	A Brucella abortus gene that has the name sodC and comes from strain 2308. 
WARN	annotation_whitespace	VO:0000166	IAO:0000115	a vaccine vector that uses a live bacterium as the vector 
WARN	annotation_whitespace	VO:0000194	IAO:0000115	a USA licensed vaccine role that inheres ina vaccine approven to be by the US FDA to be used for humans in the USA. 
WARN	annotation_whitespace	VO:0000207	IAO:0000115	A vaccine contraindication is a contraindication that increases the risks of a vaccination. 
WARN	annotation_whitespace	VO:0000208	IAO:0000115	a vaccine role that is not licensed or in clinical trial; instead, it has been experimently approved to induce protection or treatment effect in vivo in at least an experimental animal model. 
WARN	annotation_whitespace	VO:0000211	IAO:0000115	an organismal quality of a whole organism vaccine where the whole organism is inactivated/killed and lacks the capability of replication. 
WARN	annotation_whitespace	VO:0000310	IAO:0000115	a vaccine additive that stabilizes the vaccine emulsification manufacturing process and makes emulsion of the vaccine easier. 
WARN	annotation_whitespace	VO:0000310	IAO:0000119	WEB: http://www.ncbi.nlm.nih.gov/pubmed/16337664 
WARN	annotation_whitespace	VO:0000335	IAO:0000115	A vaccination site that is used for injection of a vaccine. 
WARN	annotation_whitespace	VO:0000369	IAO:0000115	A 'has vaccine component' relation that specifies the plasmid used for development of a particular DNA vaccine. 
WARN	annotation_whitespace	VO:0000375	IAO:0000112	'Mycobacterium avium relA mutant vaccine' includes a gene mutation of relA from virulent Mycobacterium avium. 
WARN	annotation_whitespace	VO:0000384	IAO:0000119	"PMID:18472194
"
WARN	annotation_whitespace	VO:0000400	IAO:0000115	a vaccine that contains one vaccine for priming and at least one other vaccine for boosting. 
WARN	annotation_whitespace	VO:0000401	IAO:0000115	a vaccine that contains one DNA vaccine for priming and at least one other vaccine for boosting. 
WARN	annotation_whitespace	VO:0000435	IAO:0000115	a vaccine component that is composed of a plasmid and used in the generation of a DNA vaccine. 
WARN	annotation_whitespace	VO:0000441	IAO:0000115	vaccine candidate role is the role of a material entity in an investigation, which has not been experimentally or clinically verified to induce a protection or treatment in vivo in a host organism. 
WARN	annotation_whitespace	VO:0000465	IAO:0000115	a S. aureus vaccine that uses bacterin as the protective antigen. 
WARN	annotation_whitespace	VO:0000467	IAO:0000115	a S. aureus vaccine that uses the bacterial phage lysate as the protective antigen. 
WARN	annotation_whitespace	VO:0000469	IAO:0000115	a bacterial vaccine that uses bacterin from a bacterial strain isolated from a herd with a purpose to generate hard-specific vaccine. 
WARN	annotation_whitespace	VO:0000470	IAO:0000115	an autogenous bacterin vaccine that is prepared for poultry use. 
WARN	annotation_whitespace	VO:0000476	IAO:0000115	A 'has vaccine component' relation that specifies a gene inserted to DNA vaccine plasmid for development of a particular DNA vaccine, and this gene encodes for a protein antigen. 
WARN	annotation_whitespace	VO:0000483	IAO:0000115	A subunit vaccine that is made using a part of whole organism as subunit for vaccine development. 
WARN	annotation_whitespace	VO:0000504	IAO:0000115	a vaccine role that indicates the vaccine being a whole organism vaccine. 
WARN	annotation_whitespace	VO:0000512	IAO:0000115	a viral vaccine against a disease caused by a virus belong to Poxviridae. 
WARN	annotation_whitespace	VO:0000524	IAO:0000116	This relation only works for those vaccine antigen that is physically part of a vaccine preparation. It does not include those antigens that are not part of vaccine. For example, a protein antigen expressed in a DNA vaccine is not a part of vaccine pe ser. In this case, the vaccine expresses the protein, but the gene is part of the vaccine, not the protein. For the case, we can use the relation 'DNA vaccine expresses protein antigen' under the relation 'expresses'. 
WARN	annotation_whitespace	VO:0000532	IAO:0000115	A route of administration that is loacted in the hypodermis (subcutaneous tissue) region. 
WARN	annotation_whitespace	VO:0000560	IAO:0000115	A toxin (from Ancient Greek: τοξικόν toxikon) is a poisonous substance produced within living cells or organisms; man-made substances created by artificial processes are thus excluded. 
WARN	annotation_whitespace	VO:0000574	IAO:0000115	A path that is located in gross anatomical part of an organism (e.g., human) and is used for administering a vaccine, a drug, fluid, poison, or other substance into the body. 
WARN	annotation_whitespace	VO:0000599	IAO:0000116	"a vaccine component that uses a microbe (e.g., bacterium, virus, and parasitic organism) as a vector that is inserted with the DNA(s) of a heterologous protective antigen(s) to generate a \""recombinant vector vaccine\"". The microorganism used as a vector generally has a stable non or low pathogenic phenotype for the species the vaccine is intended for. "
WARN	annotation_whitespace	VO:0000608	IAO:0000115	An 'expresses' relation that specifies a relation between a DNA vaccine and a  protein antigen to be expressed by the DNA vaccine. 
WARN	annotation_whitespace	VO:0000615	IAO:0000115	A role that inheres in a prepared material entity that is designed to induce protection or treatment for a disease or infection. 
WARN	annotation_whitespace	VO:0000617	IAO:0000115	A role that inheres in a material entity that becomes an ingredient of a vaccine. 
WARN	annotation_whitespace	VO:0000622	IAO:0000115	a vaccine antigen role that inheres in a vaccine antigen which is capable of inducing protective immunity. 
WARN	annotation_whitespace	VO:0000623	IAO:0000115	a vaccine role that indicates the vaccine being a DNA vaccine. 
WARN	annotation_whitespace	VO:0000624	IAO:0000115	a vaccine role that indicates the vaccine being a subunit vaccine. 
WARN	annotation_whitespace	VO:0000625	IAO:0000115	a vaccine role that indicates the vaccine being a conjugate vaccine. 
WARN	annotation_whitespace	VO:0000636	IAO:0000115	a vaccine role that indicates the vaccine being a recombinant vector vaccine. 
WARN	annotation_whitespace	VO:0000663	IAO:0000115	A live attenuated Shigella flexneri 2a vaccine that carries deletions of the plasmid-borne virulence gene icsA (mediating intra- and intercellular spread) and the chromosomal locus iuc (encoding aerobactin). 
WARN	annotation_whitespace	VO:0000671	IAO:0000115	a Salmonella vaccine against typhoid fever (or called typoid), caused by Salmonella enterica enterica, serovar Typhi. 
WARN	annotation_whitespace	VO:0000675	IAO:0000115	a Streptococcal vaccine that is used against S. pneumoniae infection, which causes pneumococcal diseases. 
WARN	annotation_whitespace	VO:0000685	IAO:0000115	a recombinant vector vaccine role that inheres in a bacterium that carries a vaccine antigen for development of a particular vaccine 
WARN	annotation_whitespace	VO:0000702	IAO:0000115	a recombinant vector vaccine role that inheres in a virus that carries a vaccine antigen for development of a particular vaccine 
WARN	annotation_whitespace	VO:0000728	IAO:0000115	a vaccine role that indicates the vaccine being a RNA vaccine. 
WARN	annotation_whitespace	VO:0000767	IAO:0000115	A bacterial vaccine that protects against diseases caused by various species of Rickettsia. Typhus is any of several similar diseases caused by Rickettsia bacteria. So Rickettsial vaccine is also called typhus vaccine. 
WARN	annotation_whitespace	VO:0000794	IAO:0000115	A Brucella abortus gene that has the name wboA and comes from strain 2308. 
WARN	annotation_whitespace	VO:0000799	IAO:0000115	An object property that represents a mutational relation between a vaccine organism and another material (e.g., gene or protein). the mutated material initially exists in the original wildtype organism. 
WARN	annotation_whitespace	VO:0000807	IAO:0000115	a vaccine role that indicates the vaccine being a toxoid vaccine. 
WARN	annotation_whitespace	VO:0000818	IAO:0000115	An object property that specifies a relation between a vaccine and a vaccine virmugen. 
WARN	annotation_whitespace	VO:0000922	IAO:0000115	a vaccine stablizer that is based on monosodium glutamate. 
WARN	annotation_whitespace	VO:0000930	IAO:0000119	WEB: http://www.wisegeek.org/what-is-polysorbate-80.htm 
WARN	annotation_whitespace	VO:0000931	IAO:0000115	a cell culture residual in vaccine that is residual protein from cell culture. 
WARN	annotation_whitespace	VO:0000957	IAO:0000115	a B. abortus vaccine that uses a recombinant vector. 
WARN	annotation_whitespace	VO:0001002	IAO:0000115	A DNA vaccine plasmid vector that has the plasmid label phCMV1.  This plasmid is 4200 base pairs long, has a CMV promoter, contains kanamycin and neomycin antibiotics resistance genes, and is manufactured by Genlantis. 
WARN	annotation_whitespace	VO:0001014	IAO:0000115	a live attenuated quality of a bacterial vaccine strain. 
WARN	annotation_whitespace	VO:0001015	IAO:0000115	a live attenuated quality of a virus vaccine strain. 
WARN	annotation_whitespace	VO:0001019	IAO:0000115	an avian reovirus vaccine that using live attenauted reovirus. 
WARN	annotation_whitespace	VO:0001021	IAO:0000115	a feline panleukopenia virus vaccine where the virus used is live attenuated. 
WARN	annotation_whitespace	VO:0001028	IAO:0000115	a parasite vaccine vector using a live attenuated Leishmania tarentolae strain.  
WARN	annotation_whitespace	VO:0001031	IAO:0000115	a bacterial vaccine vector using a live attenuated Salmonella enterica strain SL3261.  
WARN	annotation_whitespace	VO:0001038	IAO:0000115	a bacterial vaccine vector using the HS93Tox- mutant of the serovar 7 strain of Actinobacillus pleuropneumoniae. This mutant lacks the genes encoding the toxin ApxA and the post-translational activating protein ApxC, but still has genes required for secretion, making it a good vector. 
WARN	annotation_whitespace	VO:0001041	IAO:0000115	"A Listeria monocytogenes vaccine vector that uses the highly attenuated LM1-2 strain
"
WARN	annotation_whitespace	VO:0001041	IAO:0000119	PMID: 23027427 
WARN	annotation_whitespace	VO:0001050	IAO:0000118	PrV vaccine vector 
WARN	annotation_whitespace	VO:0001060	IAO:0000118	NDV vaccine vector 
WARN	annotation_whitespace	VO:0001068	IAO:0000115	A Herpes simplex virus vaccine vector that uses a virus type 1 strain 
WARN	annotation_whitespace	VO:0001082	IAO:0000115	an adenovirus vaccine vector that contains a deletion of the gp64 gene. As a result of the deletion, this vector is unable to propagate infection from cell to cell, and this defect results from both a severe reduction in the production of budded virions and the absence of GP64 on virions. 
WARN	annotation_whitespace	VO:0001084	IAO:0000115	a viral vaccine vector that uses a baculovirus as the vector 
WARN	annotation_whitespace	VO:0001107	IAO:0000115	a vaccinia virus vector that uses the Modified Vaccinia Ankara (MVA) virus. 
WARN	annotation_whitespace	VO:0001109	IAO:0000115	a vaccinia virus vector that uses the MVTT vaccine strain as the vector. MVTT is an attenuated vaccine strain. 
WARN	annotation_whitespace	VO:0001111	IAO:0000115	A poxvirus vaccine vector that uses an attenuated lumpy skin disease virus as the vector.  
WARN	annotation_whitespace	VO:0001128	IAO:0000115	a canarypox vaccine vector that uses an attenuated canarypox virus strain ALVAC. The ALVAC vector is a canarypox virus clone obtained after four rounds of plaque purification of a strain from a vaccine for canaries. 
WARN	annotation_whitespace	VO:0001186	IAO:0000119	Todd TE, Tibi O, Lin Y, Sayers S, Bronner DN, Xiang Z, He Y. Meta-analysis of variables affecting mouse protection efficacy of whole organism Brucella vaccines and vaccine candidates. BMC Bioinformatics. 2013, 14(Suppl 6):S3. PMID: 23735014. PMCID: PMC3633026. 
WARN	annotation_whitespace	VO:0001188	IAO:0000115	A measurement datum that represents a vaccine strain. Different strains can be represented using distinct digital numbers. 
WARN	annotation_whitespace	VO:0001188	IAO:0000119	Todd TE, Tibi O, Lin Y, Sayers S, Bronner DN, Xiang Z, He Y. Meta-analysis of variables affecting mouse protection efficacy of whole organism Brucella vaccines and vaccine candidates. BMC Bioinformatics. 2013, 14(Suppl 6):S3. PMID: 23735014. PMCID: PMC3633026. 
WARN	annotation_whitespace	VO:0001189	IAO:0000119	Todd TE, Tibi O, Lin Y, Sayers S, Bronner DN, Xiang Z, He Y. Meta-analysis of variables affecting mouse protection efficacy of whole organism Brucella vaccines and vaccine candidates. BMC Bioinformatics. 2013, 14(Suppl 6):S3. PMID: 23735014. PMCID: PMC3633026. 
WARN	annotation_whitespace	VO:0001190	IAO:0000115	A measurement datum that indicates the usage of a vaccine adjuvant. Different digital numbers can be used to represent different adjuvants. 
WARN	annotation_whitespace	VO:0001190	IAO:0000119	Todd TE, Tibi O, Lin Y, Sayers S, Bronner DN, Xiang Z, He Y. Meta-analysis of variables affecting mouse protection efficacy of whole organism Brucella vaccines and vaccine candidates. BMC Bioinformatics. 2013, 14(Suppl 6):S3. PMID: 23735014. PMCID: PMC3633026. 
WARN	annotation_whitespace	VO:0001191	IAO:0000115	A measurement datum that represents a specific protective antigen used in a vaccine. The antigen can be represented by a described digit. 
WARN	annotation_whitespace	VO:0001191	IAO:0000119	Todd TE, Tibi O, Lin Y, Sayers S, Bronner DN, Xiang Z, He Y. Meta-analysis of variables affecting mouse protection efficacy of whole organism Brucella vaccines and vaccine candidates. BMC Bioinformatics. 2013, 14(Suppl 6):S3. PMID: 23735014. PMCID: PMC3633026. 
WARN	annotation_whitespace	VO:0001192	IAO:0000115	A measurement datum that represents a specific mutated gene from a vaccine strain. The mutated can be represented by a described digit. 
WARN	annotation_whitespace	VO:0001192	IAO:0000119	Todd TE, Tibi O, Lin Y, Sayers S, Bronner DN, Xiang Z, He Y. Meta-analysis of variables affecting mouse protection efficacy of whole organism Brucella vaccines and vaccine candidates. BMC Bioinformatics. 2013, 14(Suppl 6):S3. PMID: 23735014. PMCID: PMC3633026. 
WARN	annotation_whitespace	VO:0001193	IAO:0000115	"A measurement datum that represents a specific mouse strain used for vaccination. Different strains can be represented using discretized digitals.  For example, 0 = BALB/c; 1 = CD1; 2 = mixed/outbred; 3 = C57BL/6; 4 = OF1; 5 = 129/Sv; 6 = Swiss albino.
"
WARN	annotation_whitespace	VO:0001193	IAO:0000119	Todd TE, Tibi O, Lin Y, Sayers S, Bronner DN, Xiang Z, He Y. Meta-analysis of variables affecting mouse protection efficacy of whole organism Brucella vaccines and vaccine candidates. BMC Bioinformatics. 2013, 14(Suppl 6):S3. PMID: 23735014. PMCID: PMC3633026. 
WARN	annotation_whitespace	VO:0001194	IAO:0000119	Todd TE, Tibi O, Lin Y, Sayers S, Bronner DN, Xiang Z, He Y. Meta-analysis of variables affecting mouse protection efficacy of whole organism Brucella vaccines and vaccine candidates. BMC Bioinformatics. 2013, 14(Suppl 6):S3. PMID: 23735014. PMCID: PMC3633026. 
WARN	annotation_whitespace	VO:0001195	IAO:0000115	"A measurement datum that represents a specific route (e.g., i.p.) used for vaccination. Different routes can be represented using discretized digitals.  0 = IP; 1 = PO; 2 = SC; 3 = IM; 4 = IN; 6 = IG; 7 = IV; 8 = ID.

"
WARN	annotation_whitespace	VO:0001195	IAO:0000119	Todd TE, Tibi O, Lin Y, Sayers S, Bronner DN, Xiang Z, He Y. Meta-analysis of variables affecting mouse protection efficacy of whole organism Brucella vaccines and vaccine candidates. BMC Bioinformatics. 2013, 14(Suppl 6):S3. PMID: 23735014. PMCID: PMC3633026. 
WARN	annotation_whitespace	VO:0001196	IAO:0000119	Todd TE, Tibi O, Lin Y, Sayers S, Bronner DN, Xiang Z, He Y. Meta-analysis of variables affecting mouse protection efficacy of whole organism Brucella vaccines and vaccine candidates. BMC Bioinformatics. 2013, 14(Suppl 6):S3. PMID: 23735014. PMCID: PMC3633026. 
WARN	annotation_whitespace	VO:0001197	IAO:0000119	Todd TE, Tibi O, Lin Y, Sayers S, Bronner DN, Xiang Z, He Y. Meta-analysis of variables affecting mouse protection efficacy of whole organism Brucella vaccines and vaccine candidates. BMC Bioinformatics. 2013, 14(Suppl 6):S3. PMID: 23735014. PMCID: PMC3633026. 
WARN	annotation_whitespace	VO:0001198	IAO:0000115	A measurement datum that represents a specific pathogen strain used for animal challenge study. Different pathogen strains can be represented using discretized digitals.  
WARN	annotation_whitespace	VO:0001198	IAO:0000119	Todd TE, Tibi O, Lin Y, Sayers S, Bronner DN, Xiang Z, He Y. Meta-analysis of variables affecting mouse protection efficacy of whole organism Brucella vaccines and vaccine candidates. BMC Bioinformatics. 2013, 14(Suppl 6):S3. PMID: 23735014. PMCID: PMC3633026. 
WARN	annotation_whitespace	VO:0001199	IAO:0000115	A measurement datum that represents a specific pathogen used for animal challenge study. Different pathogens can be represented using discretized digitals.  
WARN	annotation_whitespace	VO:0001199	IAO:0000119	Todd TE, Tibi O, Lin Y, Sayers S, Bronner DN, Xiang Z, He Y. Meta-analysis of variables affecting mouse protection efficacy of whole organism Brucella vaccines and vaccine candidates. BMC Bioinformatics. 2013, 14(Suppl 6):S3. PMID: 23735014. PMCID: PMC3633026. 
WARN	annotation_whitespace	VO:0001202	IAO:0000119	Todd TE, Tibi O, Lin Y, Sayers S, Bronner DN, Xiang Z, He Y. Meta-analysis of variables affecting mouse protection efficacy of whole organism Brucella vaccines and vaccine candidates. BMC Bioinformatics. 2013, 14(Suppl 6):S3. PMID: 23735014. PMCID: PMC3633026. 
WARN	annotation_whitespace	VO:0001203	IAO:0000115	A measurement datum that represents a length of days as the interval between a vaccination and a challenge in a specific vaccine protection study. 
WARN	annotation_whitespace	VO:0001203	IAO:0000119	Todd TE, Tibi O, Lin Y, Sayers S, Bronner DN, Xiang Z, He Y. Meta-analysis of variables affecting mouse protection efficacy of whole organism Brucella vaccines and vaccine candidates. BMC Bioinformatics. 2013, 14(Suppl 6):S3. PMID: 23735014. PMCID: PMC3633026. 
WARN	annotation_whitespace	VO:0001204	IAO:0000119	Todd TE, Tibi O, Lin Y, Sayers S, Bronner DN, Xiang Z, He Y. Meta-analysis of variables affecting mouse protection efficacy of whole organism Brucella vaccines and vaccine candidates. BMC Bioinformatics. 2013, 14(Suppl 6):S3. PMID: 23735014. PMCID: PMC3633026. 
WARN	annotation_whitespace	VO:0001205	IAO:0000119	Todd TE, Tibi O, Lin Y, Sayers S, Bronner DN, Xiang Z, He Y. Meta-analysis of variables affecting mouse protection efficacy of whole organism Brucella vaccines and vaccine candidates. BMC Bioinformatics. 2013, 14(Suppl 6):S3. PMID: 23735014. PMCID: PMC3633026. 
WARN	annotation_whitespace	VO:0001206	IAO:0000119	Todd TE, Tibi O, Lin Y, Sayers S, Bronner DN, Xiang Z, He Y. Meta-analysis of variables affecting mouse protection efficacy of whole organism Brucella vaccines and vaccine candidates. BMC Bioinformatics. 2013, 14(Suppl 6):S3. PMID: 23735014. PMCID: PMC3633026. 
WARN	annotation_whitespace	VO:0001214	IAO:0000115	a bacterial vaccine that uses inactivated bacterial organism. 
WARN	annotation_whitespace	VO:0001215	IAO:0000115	an anti-reproductive vaccine for cattle. The vaccine is based on the established principle that antibodies to the hypothalamic releasing hormone, gonadotrophin releasing hormone (GnRH) block the action of GnRH on pituitary secretion of luteinizing hormone and follicle stimulating hormone, leading to gonadal atrophy in mammals. The vaccine comprises an immunogenic GnRH:ovalbumin conjugate formulated in a novel double adjuvant system and is administered in a two-dose treatment regimen. 
WARN	annotation_whitespace	VO:0001245	IAO:0000115	SYNFLORIX is indicated for active immunization of infants and children from 6 weeks up to 5 years of age against Streptococcus pneumoniae serotypes 1, 4, 5, 6B, 7F, 9V, 14, 18C, 19F and 23F and invasive disease caused by these serotypes (including sepsis, meningitis, bacteraemic pneumonia, pleural empyema and bacteraemia). 
WARN	annotation_whitespace	VO:0001380	IAO:0000117	Oliver He 
WARN	annotation_whitespace	VO:0001395	IAO:0000115	a vaccine that contains two or more individual vaccines. 
WARN	annotation_whitespace	VO:0002115	IAO:0000115	A horse Encephalomyelitis-Influenza-West Nile Virus vaccine that is inactivated and manufactured by Wyeth Pharmaceuticals Inc. 
WARN	annotation_whitespace	VO:0002483	IAO:0000115	A horse vaccine that protects against EEE, VEE, WEE, influenza virius infection, and West Nile virus infection. 
WARN	annotation_whitespace	VO:0003016	IAO:0000115	A route of administration that located in the stomach, so that the material is taken into body through stomach directly. 
WARN	annotation_whitespace	VO:0003023	IAO:0000115	A vaccine prepration process that mixes vaccine lyophilized powder and diluent liquid. The process forms a vaccine that can be used for administration. This term can also be considered as a child term of OBI term 'material combination'. 
WARN	annotation_whitespace	VO:0003024	IAO:0000115	a vaccine powder that is freeze-dried and lyophilized. 
WARN	annotation_whitespace	VO:0003033	IAO:0000115	a protein vaccine stablizer that is specifically bovine serum albumin. 
WARN	annotation_whitespace	VO:0003035	IAO:0000115	a vaccine stabilizer that is generated based on amino acids. 
WARN	annotation_whitespace	VO:0003036	IAO:0000115	a vaccine stabilizer that is specifically made by a sucrose. 
WARN	annotation_whitespace	VO:0003039	IAO:0000115	a polysorbate 20 vaccine stabilizer that is Alkest TW20.  
WARN	annotation_whitespace	VO:0003040	IAO:0000115	a polysorbate 20 vaccine stabilizer that is Tween 20. 
WARN	annotation_whitespace	VO:0003041	IAO:0000115	an antibiotics vaccine residual that has the antibiotics of neomycin. 
WARN	annotation_whitespace	VO:0003042	IAO:0000115	the vaccine antiegn that induces protective immune response. 
WARN	annotation_whitespace	VO:0003048	IAO:0000115	when the vaccination of a significant portion of a population (or herd), in contagious diseases that are transmitted from individual to individual, chains of infection are likely to be disrupted, so the large numbers of a population are immue or less susceptible to the disease. 
WARN	annotation_whitespace	VO:0003050	IAO:0000115	role inheres in a material eneitity that union itself chemically with a relative weak vaccine antigen to form a new whole that can create an effective miinuogen. The 
WARN	annotation_whitespace	VO:0003057	IAO:0000115	an vaccine-induced host response that shows augmented protection and cellular immunity after a host protein is used as adjuvant. 
WARN	annotation_whitespace	VO:0003247	IAO:0000115	The site that is the part of the host body and the entrance point where a vaccine is administered. 
WARN	annotation_whitespace	VO:0003336	IAO:0000115	a vaccine-induced down-regulation gene expression that occurs in live attenuated vaccine and compared with the host system infected with live wild type virulent strain which is the parent strain of this live attenuated vaccine. 
WARN	annotation_whitespace	VO:0003348	IAO:0000115	A vaccine-induced up-regulation gene expression that occurs in live attenuated vaccine and compared with the host system infected with live wild type virulent strain which is the parent strain of this live attenuated vaccine. 
WARN	annotation_whitespace	VO:0004227	IAO:0000117	Oliver He 
WARN	annotation_whitespace	VO:0004228	IAO:0000117	Oliver He 
WARN	annotation_whitespace	VO:0004250	IAO:0000117	Oliver He 
WARN	annotation_whitespace	VO:0004400	IAO:0000115	An autologous dendritic cell vaccine with potential immunostimulatory activity. Dendritic cells harvested from a prostate cancer patient are transfected with the mRNA encoding for prostate specific antigen (PSA), a tumor marker secreted by prostatic epithelial and ductal cells. When reintroduced back to the patient, these PSA RNA pulsed autologous dendritic cells may elicit a cytotoxic T-cell (CTL) response against PSA-positive prostate cancer cells. 
