Level	Rule Name	Subject	Property	Value
INFO	missing_superclass	methylation interference footprinting evidence used in automatic assertion	rdfs:subClassOf	
INFO	missing_superclass	primer extension assay evidence used in automatic assertion	rdfs:subClassOf	
INFO	missing_superclass	quantitative polymerase chain reaction evidence used in automatic assertion	rdfs:subClassOf	
INFO	missing_superclass	rapid amplification of cDNA ends polymerase chain reaction evidence used in automatic assertion	rdfs:subClassOf	
INFO	missing_superclass	S1 nuclease protection assay evidence used in automatic assertion	rdfs:subClassOf	
INFO	missing_superclass	site-directed mutagenesis phenotypic evidence used in automatic assertion	rdfs:subClassOf	
INFO	missing_superclass	survival rate analysis evidence used in automatic assertion	rdfs:subClassOf	
INFO	missing_superclass	ultraviolet light footprinting evidence used in automatic assertion	rdfs:subClassOf	
INFO	missing_superclass	xylE reporter gene assay evidence used in automatic assertion	rdfs:subClassOf	
INFO	missing_superclass	ad-hoc qualitative phenotype observation evidence used in automatic assertion	rdfs:subClassOf	
INFO	missing_superclass	ad-hoc quantitative phenotype observation evidence used in automatic assertion	rdfs:subClassOf	
INFO	missing_superclass	cell transfection experiment evidence used in automatic assertion	rdfs:subClassOf	
INFO	missing_superclass	yeast 2-hybrid evidence used in automatic assertion	rdfs:subClassOf	
INFO	missing_superclass	Cya fusion reporter assay evidence used in automatic assertion	rdfs:subClassOf	
INFO	missing_superclass	super-resolution microscopy evidence used in automatic assertion	rdfs:subClassOf	
INFO	missing_superclass	fractionation evidence used in automatic assertion	rdfs:subClassOf	
INFO	missing_superclass	electrophysiology assay evidence used in automatic assertion	rdfs:subClassOf	
INFO	missing_superclass	mRNA interactome capture evidence used in automatic assertion	rdfs:subClassOf	
INFO	missing_superclass	patch-clamp recording evidence used in automatic assertion	rdfs:subClassOf	
INFO	missing_superclass	whole-cell patch-clamp recording evidence used in automatic assertion	rdfs:subClassOf	
INFO	missing_superclass	author statement from published clinical study used in automatic assertion	rdfs:subClassOf	
INFO	missing_superclass	inference based on individual clinical experience used in automatic assertion	rdfs:subClassOf	
INFO	missing_superclass	biofilm formation assay evidence used in automatic assertion	rdfs:subClassOf	
INFO	missing_superclass	microtiter plate biofilm assay evidence used in automatic assertion	rdfs:subClassOf	
INFO	missing_superclass	air-liquid interface assay evidence used in automatic assertion	rdfs:subClassOf	
INFO	missing_superclass	colony biofilm assay evidence used in automatic assertion	rdfs:subClassOf	
INFO	missing_superclass	Kadouri drip-fed biofilm assay evidence used in automatic assertion	rdfs:subClassOf	
INFO	missing_superclass	co-immunoprecipitation evidence used in automatic assertion	rdfs:subClassOf	
INFO	missing_superclass	optogenetic evidence used in automatic assertion	rdfs:subClassOf	
INFO	missing_superclass	fluorescent sensor evidence used in automatic assertion	rdfs:subClassOf	
INFO	missing_superclass	genetically encoded fluorescent sensor evidence used in automatic assertion	rdfs:subClassOf	
INFO	missing_superclass	genetically encoded fluorescent electrophysiology assay evidence used in automatic assertion	rdfs:subClassOf	
INFO	missing_superclass	genetically encoded fluorescent ion concentration sensor assay evidence used in automatic assertion	rdfs:subClassOf	
INFO	missing_superclass	cell fractionation evidence used in automatic assertion	rdfs:subClassOf	
INFO	missing_superclass	extracellular recording evidence used in automatic assertion	rdfs:subClassOf	
INFO	missing_superclass	single-unit extracellular recording evidence used in automatic assertion	rdfs:subClassOf	
INFO	missing_superclass	field potential recording evidence used in automatic assertion	rdfs:subClassOf	
INFO	missing_superclass	anti-sense experiment evidence used in automatic assertion	rdfs:subClassOf	
INFO	missing_superclass	morpholino experiment evidence used in automatic assertion	rdfs:subClassOf	
INFO	missing_superclass	RNAi evidence used in automatic assertion	rdfs:subClassOf	
INFO	missing_superclass	pharmacological assay evidence used in automatic assertion	rdfs:subClassOf	
INFO	missing_superclass	immunofluorescence wide-field microscopy evidence used in automatic assertion	rdfs:subClassOf	
INFO	missing_superclass	wide-field fluorescence microscopy evidence used in automatic assertion	rdfs:subClassOf	
INFO	missing_superclass	over expression analysis evidence used in automatic assertion	rdfs:subClassOf	
INFO	missing_superclass	cell-free assay evidence used in automatic assertion	rdfs:subClassOf	
INFO	missing_superclass	fluorescence recovery after photobleaching evidence used in automatic assertion	rdfs:subClassOf	
INFO	missing_superclass	immuno-labelling electron microscopy evidence used in automatic assertion	rdfs:subClassOf	
INFO	missing_superclass	immunofluorescence super resolution microscopy evidence used in automatic assertion	rdfs:subClassOf	
INFO	missing_superclass	co-purification evidence used in automatic assertion	rdfs:subClassOf	
INFO	missing_superclass	yeast one-hybrid evidence used in automatic assertion	rdfs:subClassOf	
INFO	missing_superclass	split-ubiquitin assay evidence used in automatic assertion	rdfs:subClassOf	
INFO	missing_superclass	far-Western blotting evidence used in automatic assertion	rdfs:subClassOf	
INFO	missing_superclass	affinity chromatography evidence used in automatic assertion	rdfs:subClassOf	
INFO	missing_superclass	ribohomopolymer binding assay evidence used in automatic assertion	rdfs:subClassOf	
INFO	missing_superclass	protein:ion binding evidence used in automatic assertion	rdfs:subClassOf	
INFO	missing_superclass	Southwestern blot evidence used in automatic assertion	rdfs:subClassOf	
INFO	missing_superclass	Northwestern blot evidence used in automatic assertion	rdfs:subClassOf	
INFO	missing_superclass	bacterial one-hybrid evidence used in automatic assertion	rdfs:subClassOf	
INFO	missing_superclass	protein-binding microarray evidence used in automatic assertion	rdfs:subClassOf	
INFO	missing_superclass	functional complementation evidence used in automatic assertion	rdfs:subClassOf	
INFO	missing_superclass	transgenic rescue experiment evidence used in automatic assertion	rdfs:subClassOf	
INFO	missing_superclass	transient rescue experiment evidence used in automatic assertion	rdfs:subClassOf	
INFO	missing_superclass	suppressor/enhancer interaction phenotypic evidence used in automatic assertion	rdfs:subClassOf	
INFO	missing_superclass	double mutant phenotypic evidence used in automatic assertion	rdfs:subClassOf	
INFO	missing_superclass	epistatic interaction phenotypic evidence used in automatic assertion	rdfs:subClassOf	
INFO	missing_superclass	functional complementation in heterologous system evidence used in automatic assertion	rdfs:subClassOf	
INFO	missing_superclass	temperature-sensitive mutant phenotypic evidence used in automatic assertion	rdfs:subClassOf	
INFO	missing_superclass	recessive mutant phenotype evidence used in automatic assertion	rdfs:subClassOf	
INFO	missing_superclass	high throughput mutant phenotypic evidence used in automatic assertion	rdfs:subClassOf	
INFO	missing_superclass	high throughput genetic interaction phenotypic evidence used in automatic assertion	rdfs:subClassOf	
INFO	missing_superclass	high throughput direct assay evidence used in automatic assertion	rdfs:subClassOf	
INFO	missing_superclass	high throughput expression pattern evidence used in automatic assertion	rdfs:subClassOf	
INFO	missing_superclass	radioligand binding assay evidence used in automatic assertion	rdfs:subClassOf	
INFO	missing_superclass	combinatorial experimental and author inference evidence used in automatic assertion	rdfs:subClassOf	
INFO	missing_superclass	combinatorial experimental and curator inference evidence used in automatic assertion	rdfs:subClassOf	
INFO	missing_superclass	voltammetry evidence used in automatic assertion	rdfs:subClassOf	
INFO	missing_superclass	photoconversion evidence used in automatic assertion	rdfs:subClassOf	
INFO	missing_superclass	agglutination test evidence used in automatic assertion	rdfs:subClassOf	
INFO	missing_superclass	slide agglutination test evidence used in automatic assertion	rdfs:subClassOf	
INFO	missing_superclass	direct Coombs test evidence used in automatic assertion	rdfs:subClassOf	
INFO	missing_superclass	indirect Coombs test evidence used in automatic assertion	rdfs:subClassOf	
INFO	missing_superclass	direct hemagglutination assay evidence used in automatic assertion	rdfs:subClassOf	
INFO	missing_superclass	viral hemagglutination inhibition assay evidence used in automatic assertion	rdfs:subClassOf	
INFO	missing_superclass	compement fixation assay evidence used in automatic assertion	rdfs:subClassOf	
INFO	missing_superclass	neutralization test assay evidence used in automatic assertion	rdfs:subClassOf	
INFO	missing_superclass	copper transport assay evidence used in automatic assertion	rdfs:subClassOf	
INFO	missing_superclass	5-cyano-2,3-ditolyl tetrazolium chloride staining evidence used in automatic assertion	rdfs:subClassOf	
INFO	missing_superclass	plaque assay evidence used in automatic assertion	rdfs:subClassOf	
INFO	missing_superclass	epifluorescence microscopy evidence used in automatic assertion	rdfs:subClassOf	
INFO	missing_superclass	transmission electron microscopy evidence used in automatic assertion	rdfs:subClassOf	
INFO	missing_superclass	scanning electron microscopy evidence used in automatic assertion	rdfs:subClassOf	
INFO	missing_superclass	time-lapsed microscopy evidence used in automatic assertion	rdfs:subClassOf	
INFO	missing_superclass	phase contrast microscopy evidence used in automatic assertion	rdfs:subClassOf	
INFO	missing_superclass	transmitted light brightfied mircoscopy evidence used in automatic assertion	rdfs:subClassOf	
INFO	missing_superclass	koehler illumination microscopy evidence used in automatic assertion	rdfs:subClassOf	
INFO	missing_superclass	differential interference contrast microscopy evidence used in automatic assertion	rdfs:subClassOf	
INFO	missing_superclass	extended field laser confocal microscopy evidence used in automatic assertion	rdfs:subClassOf	
INFO	missing_superclass	confocal laser scanning microscopy evidence used in automatic assertion	rdfs:subClassOf	
INFO	missing_superclass	light scattering assay evidence used in automatic assertion	rdfs:subClassOf	
INFO	missing_superclass	dynamic light scattering assay evidence used in automatic assertion	rdfs:subClassOf	
INFO	missing_superclass	static light scattering assay evidence used in automatic assertion	rdfs:subClassOf	
INFO	missing_superclass	colony papillation assay phenotypic evidence used in automatic assertion	rdfs:subClassOf	
INFO	missing_superclass	crystal violet staining evidence used in automatic assertion	rdfs:subClassOf	
INFO	missing_superclass	flow cell biofilm assay evidence used in automatic assertion	rdfs:subClassOf	
INFO	missing_superclass	bacterial 2-hybrid assay evidence used in automatic assertion	rdfs:subClassOf	
INFO	missing_superclass	phenomic profiling assay evidence used in automatic assertion	rdfs:subClassOf	
INFO	missing_superclass	colony morphology phenotypic evidence used in automatic assertion	rdfs:subClassOf	
INFO	missing_superclass	colony color phenotypic evidence used in automatic assertion	rdfs:subClassOf	
INFO	missing_superclass	colony size phenotypic evidence used in automatic assertion	rdfs:subClassOf	
INFO	missing_superclass	zone of inhibition evidence used in automatic assertion	rdfs:subClassOf	
INFO	missing_superclass	Etest evidence used in automatic assertion	rdfs:subClassOf	
INFO	missing_superclass	ribosome profiling evidence used in automatic assertion	rdfs:subClassOf	
INFO	missing_superclass	computational inference used in manual assertion	rdfs:subClassOf	
INFO	missing_superclass	transcriptional activation assay evidence used in manual assertion	rdfs:subClassOf	
INFO	missing_superclass	transcriptional activation assay evidence used in automatic assertion	rdfs:subClassOf	
INFO	missing_superclass	experimental phenotypic evidence used in manual assertion	rdfs:subClassOf	
INFO	missing_superclass	experimental phenotypic evidence used in automatic assertion	rdfs:subClassOf	
INFO	missing_superclass	manually integrated combinatorial computational evidence	rdfs:subClassOf	
INFO	missing_superclass	manually integrated combinatorial computational evidence used in manual assertion	rdfs:subClassOf	
INFO	missing_superclass	manually integrated combinatorial computational evidence used in automatic assertion	rdfs:subClassOf	
INFO	missing_superclass	automatically integrated combinatorial computational evidence	rdfs:subClassOf	
INFO	missing_superclass	automatically integrated combinatorial computational evidence used in manual assertion	rdfs:subClassOf	
INFO	missing_superclass	automatically integrated combinatorial computational evidence used in automatic assertion	rdfs:subClassOf	
INFO	missing_superclass	combinatorial experimental evidence	rdfs:subClassOf	
INFO	missing_superclass	manually integrated combinatorial experimental evidence	rdfs:subClassOf	
INFO	missing_superclass	manually integrated combinatorial experimental evidence used in manual assertion	rdfs:subClassOf	
INFO	missing_superclass	manually integrated combinatorial experimental evidence used in automatic assertion	rdfs:subClassOf	
INFO	missing_superclass	automatically integrated combinatorial experimental evidence	rdfs:subClassOf	
INFO	missing_superclass	automatically integrated combinatorial experimental evidence used in manual assertion	rdfs:subClassOf	
INFO	missing_superclass	automatically integrated combinatorial experimental evidence used in automatic assertion	rdfs:subClassOf	
INFO	missing_superclass	combinatorial computational and experimental evidence	rdfs:subClassOf	
INFO	missing_superclass	manually integrated combinatorial computational and experimental evidence	rdfs:subClassOf	
INFO	missing_superclass	manually integrated combinatorial computational and experimental evidence used in manual assertion	rdfs:subClassOf	
INFO	missing_superclass	manually integrated combinatorial computational and experimental evidence used in automatic assertion	rdfs:subClassOf	
INFO	missing_superclass	automatically integrated combinatorial computational and experimental evidence	rdfs:subClassOf	
INFO	missing_superclass	automatically integrated combinatorial computational and experimental evidence used in manual assertion	rdfs:subClassOf	
INFO	missing_superclass	automatically integrated combinatorial computational and experimental evidence used in automatic assertion	rdfs:subClassOf	
INFO	missing_superclass	computational evidence used in manual assertion	rdfs:subClassOf	
INFO	missing_superclass	computational evidence used in automatic assertion	rdfs:subClassOf	
INFO	missing_superclass	manually integrated combinatorial evidence used in manual assertion	rdfs:subClassOf	
INFO	missing_superclass	manually integrated combinatorial evidence used in automatic assertion	rdfs:subClassOf	
INFO	missing_superclass	combinatorial computational evidence	rdfs:subClassOf	
INFO	missing_superclass	combinatorial computational evidence used in manual assertion	rdfs:subClassOf	
INFO	missing_superclass	combinatorial computational evidence used in automatic assertion	rdfs:subClassOf	
INFO	missing_superclass	chromatography evidence used in manual assertion	rdfs:subClassOf	
INFO	missing_superclass	chromatography evidence used in automatic assertion	rdfs:subClassOf	
INFO	missing_superclass	protein inhibition evidence used in manual assertion	rdfs:subClassOf	
INFO	missing_superclass	curator inference from authoritative source used in manual assertion	rdfs:subClassOf	
INFO	missing_superclass	curator inference from encyclopedia used in manual assertion	rdfs:subClassOf	
INFO	missing_superclass	curator inference from Wikipedia used in manual assertion	rdfs:subClassOf	
INFO	missing_superclass	curator inference from MedlinePlus encyclopedia used in manual assertion	rdfs:subClassOf	
INFO	missing_superclass	curator inference from book used in manual assertion	rdfs:subClassOf	
INFO	missing_superclass	curator inference from journal publication used in manual assertion	rdfs:subClassOf	
INFO	missing_superclass	curator inference from database used in manual assertion	rdfs:subClassOf	
INFO	missing_superclass	curator inference from dictionary used in manual assertion	rdfs:subClassOf	
INFO	missing_superclass	curator inference from MedlinePlus dictionary used in manual assertion	rdfs:subClassOf	
INFO	missing_superclass	curator inference from Oxford Dictionary used in manual assertion	rdfs:subClassOf	
INFO	missing_superclass	curator inference from Merriam-Webster Dictionary used in manual assertion	rdfs:subClassOf	
INFO	missing_superclass	reporter gene assay evidence used in automatic assertion	rdfs:subClassOf	
INFO	missing_superclass	voltage clamp recording evidence used in automatic assertion	rdfs:subClassOf	
INFO	missing_superclass	protein kinase assay evidence used in automatic assertion	rdfs:subClassOf	
INFO	missing_superclass	transcription assay evidence used in automatic assertion	rdfs:subClassOf	
INFO	missing_superclass	gel electrophoresis evidence used in automatic assertion	rdfs:subClassOf	
INFO	missing_superclass	sodium dodecyl sulfate polyacrylamide gel electrophoresis evidence used in automatic assertion	rdfs:subClassOf	
INFO	missing_superclass	deacetylation assay evidence used in automatic assertion	rdfs:subClassOf	
INFO	missing_superclass	phosphatase assay evidence used in automatic assertion	rdfs:subClassOf	
INFO	missing_superclass	cell-based assay evidence used in automatic assertion	rdfs:subClassOf	
INFO	missing_superclass	cell viability assay evidence used in automatic assertion	rdfs:subClassOf	
INFO	missing_superclass	cell proliferation assay evidence used in automatic assertion	rdfs:subClassOf	
INFO	missing_superclass	DNA synthesis cell proliferation assay evidence used in automatic assertion	rdfs:subClassOf	
INFO	missing_superclass	apoptotic assay evidence used in automatic assertion	rdfs:subClassOf	
INFO	missing_superclass	cell growth assay evidence used in automatic assertion	rdfs:subClassOf	
INFO	missing_superclass	disk diffusion test evidence used in automatic assertion	rdfs:subClassOf	
INFO	missing_superclass	chemotaxis assay evidence used in automatic assertion	rdfs:subClassOf	
INFO	missing_superclass	cytotoxicity assay evidence used in automatic assertion	rdfs:subClassOf	
INFO	missing_superclass	cleavage assay evidence used in automatic assertion	rdfs:subClassOf	
INFO	missing_superclass	methylation assay evidence used in automatic assertion	rdfs:subClassOf	
INFO	missing_superclass	protein inhibition evidence used in automatic assertion	rdfs:subClassOf	
INFO	missing_superclass	chromatin immunoprecipitation evidence used in automatic assertion	rdfs:subClassOf	
INFO	missing_superclass	protein separation evidence used in automatic assertion	rdfs:subClassOf	
INFO	missing_superclass	sumoylation assay evidence used in automatic assertion	rdfs:subClassOf	
INFO	missing_superclass	transport assay evidence used in automatic assertion	rdfs:subClassOf	
INFO	missing_superclass	defarnesylation assay evidence used in automatic assertion	rdfs:subClassOf	
INFO	missing_superclass	deubiquitination assay evidence used in automatic assertion	rdfs:subClassOf	
INFO	missing_superclass	palmitoylation assay evidence used in automatic assertion	rdfs:subClassOf	
INFO	missing_superclass	ex vivo assay evidence used in automatic assertion	rdfs:subClassOf	
INFO	missing_superclass	acetylation assay evidence used in automatic assertion	rdfs:subClassOf	
INFO	missing_superclass	demethylation assay evidence used in automatic assertion	rdfs:subClassOf	
INFO	missing_superclass	immunodetection assay evidence used in automatic assertion	rdfs:subClassOf	
INFO	missing_superclass	polyADP-ribosylation assay evidence used in automatic assertion	rdfs:subClassOf	
INFO	missing_superclass	staining evidence used in automatic assertion	rdfs:subClassOf	
INFO	missing_superclass	translation assay evidence used in automatic assertion	rdfs:subClassOf	
INFO	missing_superclass	farnesylation assay evidence used in automatic assertion	rdfs:subClassOf	
INFO	missing_superclass	ubiquitination assay evidence used in automatic assertion	rdfs:subClassOf	
INFO	missing_superclass	desumoylation assay evidence used in automatic assertion	rdfs:subClassOf	
INFO	missing_superclass	reconstitution assay evidence used in automatic assertion	rdfs:subClassOf	
INFO	missing_superclass	in vitro transcription reconstitution assay evidence used in automatic assertion	rdfs:subClassOf	
INFO	missing_superclass	substance quantification evidence used in automatic assertion	rdfs:subClassOf	
INFO	missing_superclass	localization evidence used in automatic assertion	rdfs:subClassOf	
INFO	missing_superclass	protein localization evidence used in automatic assertion	rdfs:subClassOf	
INFO	missing_superclass	fusion protein localization evidence used in automatic assertion	rdfs:subClassOf	
INFO	missing_superclass	nucleic acid localization evidence used in automatic assertion	rdfs:subClassOf	
INFO	missing_superclass	anatomical perturbation phenotypic evidence used in automatic assertion	rdfs:subClassOf	
INFO	missing_superclass	cleavage arrested development evidence used in automatic assertion	rdfs:subClassOf	
INFO	missing_superclass	sequencing assay evidence used in automatic assertion	rdfs:subClassOf	
INFO	missing_superclass	nucleotide sequencing assay evidence used in automatic assertion	rdfs:subClassOf	
INFO	missing_superclass	high throughput nucleotide sequencing assay evidence used in automatic assertion	rdfs:subClassOf	
INFO	missing_superclass	structure determination evidence used in automatic assertion	rdfs:subClassOf	
INFO	missing_superclass	molecule detection assay evidence used in automatic assertion	rdfs:subClassOf	
INFO	missing_superclass	DNA detection assay evidence used in automatic assertion	rdfs:subClassOf	
INFO	missing_superclass	RNA detection assay evidence used in automatic assertion	rdfs:subClassOf	
INFO	missing_superclass	protein detection assay evidence used in automatic assertion	rdfs:subClassOf	
INFO	missing_superclass	small molecule detection assay evidence used in automatic assertion	rdfs:subClassOf	
INFO	missing_superclass	spectrometry evidence used in automatic assertion	rdfs:subClassOf	
INFO	missing_superclass	chromosome conformation-based evidence used in automatic assertion	rdfs:subClassOf	
INFO	missing_superclass	3C evidence used in automatic assertion	rdfs:subClassOf	
INFO	missing_superclass	phenotypic similarity evidence used in automatic assertion	rdfs:subClassOf	
INFO	missing_superclass	transcript splice pattern evidence used in automatic assertion	rdfs:subClassOf	
INFO	missing_superclass	phylogenetic evidence used in automatic assertion	rdfs:subClassOf	
INFO	missing_superclass	biological system reconstruction evidence used in automatic assertion	rdfs:subClassOf	
INFO	missing_superclass	biological system reconstruction evidence by experimental evidence used in automatic assertion	rdfs:subClassOf	
INFO	missing_superclass	combinatorial computational and experimental evidence used in automatic assertion	rdfs:subClassOf	
INFO	missing_superclass	combinatorial experimental evidence used in automatic assertion	rdfs:subClassOf	
INFO	missing_superclass	inferential evidence used in automatic assertion	rdfs:subClassOf	
INFO	missing_superclass	curator inference from authoritative source used in automatic assertion	rdfs:subClassOf	
INFO	missing_superclass	curator inference from encyclopedia used in automatic assertion	rdfs:subClassOf	
INFO	missing_superclass	curator inference from Wikipedia used in automatic assertion	rdfs:subClassOf	
INFO	missing_superclass	curator inference from Britannica used in automatic assertion	rdfs:subClassOf	
INFO	missing_superclass	curator inference from MedlinePlus encyclopedia used in automatic assertion	rdfs:subClassOf	
INFO	missing_superclass	curator inference from book used in automatic assertion	rdfs:subClassOf	
INFO	missing_superclass	curator inference from dictionary used in automatic assertion	rdfs:subClassOf	
INFO	missing_superclass	curator inference from MedlinePlus dictionary used in automatic assertion	rdfs:subClassOf	
INFO	missing_superclass	curator inference from Merriam-Webster Dictionary used in automatic assertion	rdfs:subClassOf	
INFO	missing_superclass	curator inference from Oxford Dictionary used in automatic assertion	rdfs:subClassOf	
INFO	missing_superclass	curator inference from journal publication used in automatic assertion	rdfs:subClassOf	
