Level	Rule Name	Subject	Property	Value
INFO	missing_superclass	frameshift mutation phenotypic evidence used in automatic assertion	rdfs:subClassOf	
INFO	missing_superclass	repeat expansion mutation phenotypic evidence used in automatic assertion	rdfs:subClassOf	
INFO	missing_superclass	splice site mutation phenotypic evidence used in automatic assertion	rdfs:subClassOf	
INFO	missing_superclass	translocation mutation phenotypic evidence used in automatic assertion	rdfs:subClassOf	
INFO	missing_superclass	in-gel protein kinase assay evidence used in automatic assertion	rdfs:subClassOf	
INFO	missing_superclass	macroscopic current trace evidence used in automatic assertion	rdfs:subClassOf	
INFO	missing_superclass	current density evidence used in automatic assertion	rdfs:subClassOf	
INFO	missing_superclass	sustained current evidence used in automatic assertion	rdfs:subClassOf	
INFO	missing_superclass	use dependence of inactivation evidence used in automatic assertion	rdfs:subClassOf	
INFO	missing_superclass	current clamp recording evidence used in automatic assertion	rdfs:subClassOf	
INFO	missing_superclass	whole-cell voltage clamp recording evidence used in automatic assertion	rdfs:subClassOf	
INFO	missing_superclass	cell-attached single-channel recording evidence used in automatic assertion	rdfs:subClassOf	
INFO	missing_superclass	cell-detached inside-out single-channel recording evidence used in automatic assertion	rdfs:subClassOf	
INFO	missing_superclass	reconstituted bilayer single-channel patch recording evidence used in automatic assertion	rdfs:subClassOf	
INFO	missing_superclass	electroencephalography recording evidence used in automatic assertion	rdfs:subClassOf	
INFO	missing_superclass	cell-detached outside-out single-channel recording evidence used in automatic assertion	rdfs:subClassOf	
INFO	missing_superclass	cut-open oocyte voltage clamp recording evidence used in automatic assertion	rdfs:subClassOf	
INFO	missing_superclass	macropatch voltage clamp recording evidence used in automatic assertion	rdfs:subClassOf	
INFO	missing_superclass	protein mass spectrometry evidence used in automatic assertion	rdfs:subClassOf	
INFO	missing_superclass	cross-streak test evidence used in automatic assertion	rdfs:subClassOf	
INFO	missing_superclass	tethered cell assay evidence used in automatic assertion	rdfs:subClassOf	
INFO	missing_superclass	tumble frequency assay evidence used in automatic assertion	rdfs:subClassOf	
INFO	missing_superclass	capillary assay evidence used in automatic assertion	rdfs:subClassOf	
INFO	missing_superclass	inference by association of genotype from phenotype used in automatic assertion	rdfs:subClassOf	
INFO	missing_superclass	motility assay evidence used in automatic assertion	rdfs:subClassOf	
INFO	missing_superclass	experimental evidence used in automatic assertion	rdfs:subClassOf	
INFO	missing_superclass	expression pattern evidence used in automatic assertion	rdfs:subClassOf	
INFO	missing_superclass	Affymetrix GeneChip evidence used in automatic assertion	rdfs:subClassOf	
INFO	missing_superclass	cRNA to DNA expression microarray evidence used in automatic assertion	rdfs:subClassOf	
INFO	missing_superclass	expression microarray evidence used in automatic assertion	rdfs:subClassOf	
INFO	missing_superclass	differential methylation hybridization evidence used in automatic assertion	rdfs:subClassOf	
INFO	missing_superclass	transcript expression evidence used in automatic assertion	rdfs:subClassOf	
INFO	missing_superclass	Nimblegen array evidence used in automatic assertion	rdfs:subClassOf	
INFO	missing_superclass	array-based sequence capture evidence used in automatic assertion	rdfs:subClassOf	
INFO	missing_superclass	qualitative western immunoblotting evidence used in automatic assertion	rdfs:subClassOf	
INFO	missing_superclass	direct assay evidence used in automatic assertion	rdfs:subClassOf	
INFO	missing_superclass	protein expression evidence used in automatic assertion	rdfs:subClassOf	
INFO	missing_superclass	expression library screen evidence used in automatic assertion	rdfs:subClassOf	
INFO	missing_superclass	heterologous protein expression evidence used in automatic assertion	rdfs:subClassOf	
INFO	missing_superclass	spatial pattern of protein expression evidence used in automatic assertion	rdfs:subClassOf	
INFO	missing_superclass	DNA to cDNA expression microarray evidence used in automatic assertion	rdfs:subClassOf	
INFO	missing_superclass	differential hybridization evidence used in automatic assertion	rdfs:subClassOf	
INFO	missing_superclass	RNA protection assay evidence used in automatic assertion	rdfs:subClassOf	
INFO	missing_superclass	nuclease protection assay evidence used in automatic assertion	rdfs:subClassOf	
INFO	missing_superclass	spatial pattern of transcript expression evidence used in automatic assertion	rdfs:subClassOf	
INFO	missing_superclass	subtractive hybridization evidence used in automatic assertion	rdfs:subClassOf	
INFO	missing_superclass	author statement used in automatic assertion	rdfs:subClassOf	
INFO	missing_superclass	author statement without traceable support used in automatic assertion	rdfs:subClassOf	
INFO	missing_superclass	author statement supported by traceable reference used in automatic assertion	rdfs:subClassOf	
INFO	missing_superclass	curator inference used in automatic assertion	rdfs:subClassOf	
INFO	missing_superclass	inference from background scientific knowledge used in automatic assertion	rdfs:subClassOf	
INFO	missing_superclass	no evidence data found used in automatic assertion	rdfs:subClassOf	
INFO	missing_superclass	mutant phenotype evidence used in automatic assertion	rdfs:subClassOf	
INFO	missing_superclass	genetic interaction evidence used in automatic assertion	rdfs:subClassOf	
INFO	missing_superclass	genomic context evidence used in automatic assertion	rdfs:subClassOf	
INFO	missing_superclass	biological aspect of ancestor evidence used in automatic assertion	rdfs:subClassOf	
INFO	missing_superclass	biological aspect of descendant evidence used in automatic assertion	rdfs:subClassOf	
INFO	missing_superclass	phylogenetic determination of loss of key residues evidence used in automatic assertion	rdfs:subClassOf	
INFO	missing_superclass	rapid divergence from ancestral sequence evidence used in automatic assertion	rdfs:subClassOf	
INFO	missing_superclass	physical interaction evidence used in automatic assertion	rdfs:subClassOf	
INFO	missing_superclass	gene neighbors evidence used in automatic assertion	rdfs:subClassOf	
INFO	missing_superclass	Edman degradation evidence used in automatic assertion	rdfs:subClassOf	
INFO	missing_superclass	3D cell culture evidence used in automatic assertion	rdfs:subClassOf	
INFO	missing_superclass	51Cr release assay evidence used in automatic assertion	rdfs:subClassOf	
INFO	missing_superclass	7-aminoactinomycin staining evidence used in automatic assertion	rdfs:subClassOf	
INFO	missing_superclass	[3H]-thymidine incorporation assay evidence used in automatic assertion	rdfs:subClassOf	
INFO	missing_superclass	[3H]arachidonic acid release assay evidence used in automatic assertion	rdfs:subClassOf	
INFO	missing_superclass	adhesion assay evidence used in automatic assertion	rdfs:subClassOf	
INFO	missing_superclass	adoptive cell transfer evidence used in automatic assertion	rdfs:subClassOf	
INFO	missing_superclass	alamarBlue assay evidence used in automatic assertion	rdfs:subClassOf	
INFO	missing_superclass	allograft transplantation phenotypic evidence used in automatic assertion	rdfs:subClassOf	
INFO	missing_superclass	anion-exchange chromatography evidence used in automatic assertion	rdfs:subClassOf	
INFO	missing_superclass	annexin-V staining evidence used in automatic assertion	rdfs:subClassOf	
INFO	missing_superclass	cognitive assay phenotypic evidence used in automatic assertion	rdfs:subClassOf	
INFO	missing_superclass	blocking monoclonal antibody evidence used in automatic assertion	rdfs:subClassOf	
INFO	missing_superclass	immunological assay evidence used in automatic assertion	rdfs:subClassOf	
INFO	missing_superclass	blocking peptide evidence used in automatic assertion	rdfs:subClassOf	
INFO	missing_superclass	blocking polyclonal antibody evidence used in automatic assertion	rdfs:subClassOf	
INFO	missing_superclass	blood test evidence used in automatic assertion	rdfs:subClassOf	
INFO	missing_superclass	Boyden chamber assay evidence used in automatic assertion	rdfs:subClassOf	
INFO	missing_superclass	bromodeoxyuridine incorporation assay evidence used in automatic assertion	rdfs:subClassOf	
INFO	missing_superclass	nucleotide analog incorporation assay evidence used in automatic assertion	rdfs:subClassOf	
INFO	missing_superclass	caspase assay evidence used in automatic assertion	rdfs:subClassOf	
INFO	missing_superclass	cell counting evidence used in automatic assertion	rdfs:subClassOf	
INFO	missing_superclass	cell permeability assay evidence used in automatic assertion	rdfs:subClassOf	
INFO	missing_superclass	carboxyfluorescein diacetate succinimidyl ester staining evidence used in automatic assertion	rdfs:subClassOf	
INFO	missing_superclass	chemiluminescence-linked immunoassay evidence used in automatic assertion	rdfs:subClassOf	
INFO	missing_superclass	chimeric protein phenotypic evidence used in automatic assertion	rdfs:subClassOf	
INFO	missing_superclass	co-electrophoresis evidence used in automatic assertion	rdfs:subClassOf	
INFO	missing_superclass	co-localization evidence used in automatic assertion	rdfs:subClassOf	
INFO	missing_superclass	imaging assay evidence used in automatic assertion	rdfs:subClassOf	
INFO	missing_superclass	co-sedimentation assay evidence used in automatic assertion	rdfs:subClassOf	
INFO	missing_superclass	colony counting evidence used in automatic assertion	rdfs:subClassOf	
INFO	missing_superclass	comet assay evidence used in automatic assertion	rdfs:subClassOf	
INFO	missing_superclass	conditional knockin evidence used in automatic assertion	rdfs:subClassOf	
INFO	missing_superclass	knockin evidence used in automatic assertion	rdfs:subClassOf	
INFO	missing_superclass	conditional knockout evidence used in automatic assertion	rdfs:subClassOf	
INFO	missing_superclass	knockout evidence used in automatic assertion	rdfs:subClassOf	
INFO	missing_superclass	constitutively active mutant evidence used in automatic assertion	rdfs:subClassOf	
INFO	missing_superclass	cross-linking evidence used in automatic assertion	rdfs:subClassOf	
INFO	missing_superclass	protein binding evidence used in automatic assertion	rdfs:subClassOf	
INFO	missing_superclass	crystallography evidence used in automatic assertion	rdfs:subClassOf	
INFO	missing_superclass	cytochemistry evidence used in automatic assertion	rdfs:subClassOf	
INFO	missing_superclass	histochemistry evidence used in automatic assertion	rdfs:subClassOf	
INFO	missing_superclass	cytochrome C release assay evidence used in automatic assertion	rdfs:subClassOf	
INFO	missing_superclass	4',6-diamidino-2-phenylindole staining evidence used in automatic assertion	rdfs:subClassOf	
INFO	missing_superclass	deletion mutation phenotypic evidence used in automatic assertion	rdfs:subClassOf	
INFO	missing_superclass	DNA laddering assay evidence used in automatic assertion	rdfs:subClassOf	
INFO	missing_superclass	RNA dot blot assay evidence used in automatic assertion	rdfs:subClassOf	
INFO	missing_superclass	dominant-negative mutant phenotypic evidence used in automatic assertion	rdfs:subClassOf	
INFO	missing_superclass	eTag assay evidence used in automatic assertion	rdfs:subClassOf	
INFO	missing_superclass	affinity evidence used in automatic assertion	rdfs:subClassOf	
INFO	missing_superclass	filter binding assay evidence used in automatic assertion	rdfs:subClassOf	
INFO	missing_superclass	fluorescence in situ hybridization evidence used in automatic assertion	rdfs:subClassOf	
INFO	missing_superclass	fluorescence resonance energy transfer evidence used in automatic assertion	rdfs:subClassOf	
INFO	missing_superclass	gel-filtration evidence used in automatic assertion	rdfs:subClassOf	
INFO	missing_superclass	histology evidence used in automatic assertion	rdfs:subClassOf	
INFO	missing_superclass	immunocytochemistry evidence used in automatic assertion	rdfs:subClassOf	
INFO	missing_superclass	immunodepletion evidence used in automatic assertion	rdfs:subClassOf	
INFO	missing_superclass	immunohistochemistry evidence used in automatic assertion	rdfs:subClassOf	
INFO	missing_superclass	in vitro acetylation assay evidence used in automatic assertion	rdfs:subClassOf	
INFO	missing_superclass	in vitro cleavage assay evidence used in automatic assertion	rdfs:subClassOf	
INFO	missing_superclass	in vitro deacetylation assay evidence used in automatic assertion	rdfs:subClassOf	
INFO	missing_superclass	in vitro defarnesylation assay evidence used in automatic assertion	rdfs:subClassOf	
INFO	missing_superclass	in vitro demethylation assay evidence used in automatic assertion	rdfs:subClassOf	
INFO	missing_superclass	in vitro desumoylation assay evidence used in automatic assertion	rdfs:subClassOf	
INFO	missing_superclass	in vitro deubiquitination assay evidence used in automatic assertion	rdfs:subClassOf	
INFO	missing_superclass	in vitro farnesylation assay evidence used in automatic assertion	rdfs:subClassOf	
INFO	missing_superclass	in vitro methylation assay evidence used in automatic assertion	rdfs:subClassOf	
INFO	missing_superclass	in vitro palmitoylation assay evidence used in automatic assertion	rdfs:subClassOf	
INFO	missing_superclass	in vitro phosphatase assay evidence used in automatic assertion	rdfs:subClassOf	
INFO	missing_superclass	in vitro polyADP-ribosylation assay evidence used in automatic assertion	rdfs:subClassOf	
INFO	missing_superclass	in vitro protein kinase assay evidence used in automatic assertion	rdfs:subClassOf	
INFO	missing_superclass	in vitro sumoylation assay evidence used in automatic assertion	rdfs:subClassOf	
INFO	missing_superclass	in vitro transcription assay evidence used in automatic assertion	rdfs:subClassOf	
INFO	missing_superclass	in vitro translation assay evidence used in automatic assertion	rdfs:subClassOf	
INFO	missing_superclass	in vitro ubiquitination assay evidence used in automatic assertion	rdfs:subClassOf	
INFO	missing_superclass	in vivo acetylation assay evidence used in automatic assertion	rdfs:subClassOf	
INFO	missing_superclass	in vivo cleavage assay evidence used in automatic assertion	rdfs:subClassOf	
INFO	missing_superclass	in vivo deacetylation assay evidence used in automatic assertion	rdfs:subClassOf	
INFO	missing_superclass	in vivo defarnesylation assay evidence used in automatic assertion	rdfs:subClassOf	
INFO	missing_superclass	in vivo demethylation assay evidence used in automatic assertion	rdfs:subClassOf	
INFO	missing_superclass	in vivo desumoylation assay evidence used in automatic assertion	rdfs:subClassOf	
INFO	missing_superclass	in vivo deubiquitination assay evidence used in automatic assertion	rdfs:subClassOf	
INFO	missing_superclass	in vivo farnesylation assay evidence used in automatic assertion	rdfs:subClassOf	
INFO	missing_superclass	in vivo methylation assay evidence used in automatic assertion	rdfs:subClassOf	
INFO	missing_superclass	in vivo palmitoylation assay evidence used in automatic assertion	rdfs:subClassOf	
INFO	missing_superclass	in vivo phosphatase assay evidence used in automatic assertion	rdfs:subClassOf	
INFO	missing_superclass	in vivo protein kinase assay evidence used in automatic assertion	rdfs:subClassOf	
INFO	missing_superclass	in vivo sumoylation assay evidence used in automatic assertion	rdfs:subClassOf	
INFO	missing_superclass	in vivo transcription assay evidence used in automatic assertion	rdfs:subClassOf	
INFO	missing_superclass	in vivo translation assay evidence used in automatic assertion	rdfs:subClassOf	
INFO	missing_superclass	in vivo ubiquitination assay evidence used in automatic assertion	rdfs:subClassOf	
INFO	missing_superclass	genetic transformation evidence used in automatic assertion	rdfs:subClassOf	
INFO	missing_superclass	lipid binding assay evidence used in automatic assertion	rdfs:subClassOf	
INFO	missing_superclass	luminescence-based mammalian interactome mapping assay evidence used in automatic assertion	rdfs:subClassOf	
INFO	missing_superclass	macroscopy evidence used in automatic assertion	rdfs:subClassOf	
INFO	missing_superclass	mammalian 2-hybrid assay evidence used in automatic assertion	rdfs:subClassOf	
INFO	missing_superclass	hybrid interaction evidence used in automatic assertion	rdfs:subClassOf	
INFO	missing_superclass	mass spectrometry evidence used in automatic assertion	rdfs:subClassOf	
INFO	missing_superclass	medical imaging evidence used in automatic assertion	rdfs:subClassOf	
INFO	missing_superclass	microscopy evidence used in automatic assertion	rdfs:subClassOf	
INFO	missing_superclass	motility wound healing assay evidence used in automatic assertion	rdfs:subClassOf	
INFO	missing_superclass	MTS assay evidence used in automatic assertion	rdfs:subClassOf	
INFO	missing_superclass	MTT assay evidence used in automatic assertion	rdfs:subClassOf	
INFO	missing_superclass	multiplex bead-based immunoassay evidence used in automatic assertion	rdfs:subClassOf	
INFO	missing_superclass	natural variation mutant evidence used in automatic assertion	rdfs:subClassOf	
INFO	missing_superclass	nuclear magnetic resonance evidence used in automatic assertion	rdfs:subClassOf	
INFO	missing_superclass	nuclear fragmentation evidence used in automatic assertion	rdfs:subClassOf	
INFO	missing_superclass	phage display evidence used in automatic assertion	rdfs:subClassOf	
INFO	missing_superclass	phosphoamino acid analysis evidence used in automatic assertion	rdfs:subClassOf	
INFO	missing_superclass	peptide affinity enrichment evidence used in automatic assertion	rdfs:subClassOf	
INFO	missing_superclass	peptide array evidence used in automatic assertion	rdfs:subClassOf	
INFO	missing_superclass	physical examination evidence used in automatic assertion	rdfs:subClassOf	
INFO	missing_superclass	point mutation phenotypic evidence used in automatic assertion	rdfs:subClassOf	
INFO	missing_superclass	propidium iodide staining evidence used in automatic assertion	rdfs:subClassOf	
INFO	missing_superclass	fluorescence evidence used in automatic assertion	rdfs:subClassOf	
INFO	missing_superclass	protein dot blot assay evidence used in automatic assertion	rdfs:subClassOf	
INFO	missing_superclass	protein microarray evidence used in automatic assertion	rdfs:subClassOf	
INFO	missing_superclass	protein sequencing assay evidence used in automatic assertion	rdfs:subClassOf	
INFO	missing_superclass	quantitative mass spectrometry evidence used in automatic assertion	rdfs:subClassOf	
INFO	missing_superclass	radioisotope assay evidence used in automatic assertion	rdfs:subClassOf	
INFO	missing_superclass	radioimmunoassay evidence used in automatic assertion	rdfs:subClassOf	
INFO	missing_superclass	restriction fragment detection evidence used in automatic assertion	rdfs:subClassOf	
INFO	missing_superclass	spectrophotometry evidence used in automatic assertion	rdfs:subClassOf	
INFO	missing_superclass	syngeneic transplantation experiment evidence used in automatic assertion	rdfs:subClassOf	
INFO	missing_superclass	xenotransplantation phenotypic evidence used in automatic assertion	rdfs:subClassOf	
INFO	missing_superclass	WST-1 assay evidence used in automatic assertion	rdfs:subClassOf	
INFO	missing_superclass	urine test evidence used in automatic assertion	rdfs:subClassOf	
INFO	missing_superclass	terminal deoxynucleotidyl transferase dUTP nick end labeling assay evidence used in automatic assertion	rdfs:subClassOf	
INFO	missing_superclass	tryptic phosphopeptide mapping assay evidence used in automatic assertion	rdfs:subClassOf	
INFO	missing_superclass	transgenic organism evidence used in automatic assertion	rdfs:subClassOf	
INFO	missing_superclass	tissue microarray evidence used in automatic assertion	rdfs:subClassOf	
INFO	missing_superclass	TACE activity assay evidence used in automatic assertion	rdfs:subClassOf	
INFO	missing_superclass	enzymatic activity assay evidence used in automatic assertion	rdfs:subClassOf	
INFO	missing_superclass	surface plasmon resonance evidence used in automatic assertion	rdfs:subClassOf	
INFO	missing_superclass	restriction landmark genomic scanning evidence used in automatic assertion	rdfs:subClassOf	
INFO	missing_superclass	resonant mirror biosensor evidence used in automatic assertion	rdfs:subClassOf	
INFO	missing_superclass	high-performance liquid chromatography evidence used in automatic assertion	rdfs:subClassOf	
INFO	missing_superclass	ectopic expression evidence used in automatic assertion	rdfs:subClassOf	
INFO	missing_superclass	electrophoretic mobility shift assay evidence used in automatic assertion	rdfs:subClassOf	
INFO	missing_superclass	reverse transcription polymerase chain reaction evidence used in automatic assertion	rdfs:subClassOf	
INFO	missing_superclass	in vivo polyADP-ribosylation assay evidence used in automatic assertion	rdfs:subClassOf	
INFO	missing_superclass	DNA dot blot assay evidence used in automatic assertion	rdfs:subClassOf	
INFO	missing_superclass	random mutagenesis evidence used in automatic assertion	rdfs:subClassOf	
INFO	missing_superclass	biological system reconstruction evidence by experimental evidence from single species used in automatic assertion	rdfs:subClassOf	
INFO	missing_superclass	biological system reconstruction evidence by experimental evidence from mixed species used in automatic assertion	rdfs:subClassOf	
INFO	missing_superclass	biological system reconstruction evidence based on orthology evidence used in automatic assertion	rdfs:subClassOf	
INFO	missing_superclass	biological system reconstruction evidence based on homology evidence used in automatic assertion	rdfs:subClassOf	
INFO	missing_superclass	biological system reconstruction evidence based on paralogy evidence used in automatic assertion	rdfs:subClassOf	
INFO	missing_superclass	biological system reconstruction evidence based on inference from background scientific knowledge used in automatic assertion	rdfs:subClassOf	
INFO	missing_superclass	immunogold labelling evidence used in automatic assertion	rdfs:subClassOf	
INFO	missing_superclass	immunolocalization evidence used in automatic assertion	rdfs:subClassOf	
INFO	missing_superclass	flow cytometry evidence used in automatic assertion	rdfs:subClassOf	
INFO	missing_superclass	enzyme-linked immunoabsorbent assay evidence used in automatic assertion	rdfs:subClassOf	
INFO	missing_superclass	high throughput mass spectrometry evidence used in automatic assertion	rdfs:subClassOf	
INFO	missing_superclass	confocal microscopy evidence used in automatic assertion	rdfs:subClassOf	
INFO	missing_superclass	wide-field microscopy evidence used in automatic assertion	rdfs:subClassOf	
INFO	missing_superclass	immunogold labelling electron microscopy assay evidence used in automatic assertion	rdfs:subClassOf	
INFO	missing_superclass	electron microscopy evidence used in automatic assertion	rdfs:subClassOf	
INFO	missing_superclass	immunoperoxidase immunolocalization evidence used in automatic assertion	rdfs:subClassOf	
INFO	missing_superclass	immunoperoxidase immunolocalization electron microscopy evidence used in automatic assertion	rdfs:subClassOf	
INFO	missing_superclass	immunofluorescence confocal microscopy evidence used in automatic assertion	rdfs:subClassOf	
INFO	missing_superclass	immunofluorescence evidence used in automatic assertion	rdfs:subClassOf	
INFO	missing_superclass	two-dimensional polyacrylamide gel electrophoresis evidence used in automatic assertion	rdfs:subClassOf	
INFO	missing_superclass	alkaline phosphatase reporter gene assay evidence used in automatic assertion	rdfs:subClassOf	
INFO	missing_superclass	beta-galactosidase reporter gene assay evidence used in automatic assertion	rdfs:subClassOf	
INFO	missing_superclass	chloramphenicol acetyltransferase reporter gene assay evidence used in automatic assertion	rdfs:subClassOf	
INFO	missing_superclass	chromatin immunoprecipitation-PCR evidence used in automatic assertion	rdfs:subClassOf	
INFO	missing_superclass	immunoprecipitation evidence used in automatic assertion	rdfs:subClassOf	
INFO	missing_superclass	copper-phenanthroline footprinting evidence used in automatic assertion	rdfs:subClassOf	
INFO	missing_superclass	nucleic acid binding evidence used in automatic assertion	rdfs:subClassOf	
INFO	missing_superclass	DNA affinity chromatography evidence used in automatic assertion	rdfs:subClassOf	
INFO	missing_superclass	DNAse footprinting evidence used in automatic assertion	rdfs:subClassOf	
INFO	missing_superclass	fluorescence anisotropy evidence used in automatic assertion	rdfs:subClassOf	
INFO	missing_superclass	ferric uptake regulator titration assay evidence used in automatic assertion	rdfs:subClassOf	
INFO	missing_superclass	systematic evolution of ligands by exponential amplification evidence used in automatic assertion	rdfs:subClassOf	
INFO	missing_superclass	glutathione S-transferase pull-down assay evidence used in automatic assertion	rdfs:subClassOf	
INFO	missing_superclass	beta-glucuronidase reporter gene assay evidence used in automatic assertion	rdfs:subClassOf	
INFO	missing_superclass	heteronuclear single quantum coherence spectroscopy evidence used in automatic assertion	rdfs:subClassOf	
INFO	missing_superclass	hydroxyl-radical footprinting evidence used in automatic assertion	rdfs:subClassOf	
INFO	missing_superclass	isothermal titration calorimetry evidence used in automatic assertion	rdfs:subClassOf	
INFO	missing_superclass	luciferase reporter gene assay evidence used in automatic assertion	rdfs:subClassOf	
INFO	missing_superclass	methidiumpropyl-ethylenediaminetetraacetic acid iron (II) footprinting evidence used in automatic assertion	rdfs:subClassOf	
INFO	missing_superclass	northern blot evidence used in automatic assertion	rdfs:subClassOf	
