Level	Rule Name	Subject	Property	Value
ERROR	duplicate_label	presence of vegetative cell population growth	rdfs:label	presence of vegetative cell population growth
ERROR	duplicate_label	presence of vegetative cell population growth	rdfs:label	presence of vegetative cell population growth
ERROR	duplicate_label	plaque size phenotype	rdfs:label	plaque size phenotype
ERROR	duplicate_label	plaque size phenotype	rdfs:label	plaque size phenotype
ERROR	duplicate_label	plaque size phenotype	rdfs:label	plaque size phenotype
ERROR	duplicate_label	plaque morphology phenotype	rdfs:label	plaque morphology phenotype
ERROR	duplicate_label	plaque morphology phenotype	rdfs:label	plaque morphology phenotype
ERROR	duplicate_label	plaque appearance phenotype	rdfs:label	plaque appearance phenotype
ERROR	duplicate_label	plaque appearance phenotype	rdfs:label	plaque appearance phenotype
ERROR	duplicate_label	nonviable vegetative cell population	rdfs:label	nonviable vegetative cell population
ERROR	duplicate_label	nonviable vegetative cell population	rdfs:label	nonviable vegetative cell population
ERROR	duplicate_label	nonviable cell population	rdfs:label	nonviable cell population
ERROR	duplicate_label	nonviable cell population	rdfs:label	nonviable cell population
ERROR	duplicate_label	increased cellular pigment accumulation	rdfs:label	increased cellular pigment accumulation
ERROR	duplicate_label	increased cellular pigment accumulation	rdfs:label	increased cellular pigment accumulation
ERROR	duplicate_label	cell wall morphology phenotype	rdfs:label	cell wall morphology phenotype
ERROR	duplicate_label	cell wall morphology phenotype	rdfs:label	cell wall morphology phenotype
ERROR	duplicate_label	altered plaque size phenotype	rdfs:label	altered plaque size phenotype
ERROR	duplicate_label	altered plaque size phenotype	rdfs:label	altered plaque size phenotype
ERROR	duplicate_label	altered plaque morphology phenotype	rdfs:label	altered plaque morphology phenotype
ERROR	duplicate_label	altered plaque morphology phenotype	rdfs:label	altered plaque morphology phenotype
ERROR	duplicate_label	altered actin cytoskeleton	rdfs:label	altered actin cytoskeleton
ERROR	duplicate_label	altered actin cytoskeleton	rdfs:label	altered actin cytoskeleton
ERROR	missing_label	obo:omp#Cross_product_review	rdfs:label	
ERROR	missing_label	obo:omp#SOFA	rdfs:label	
ERROR	missing_label	obo:omp#abnormal_slim	rdfs:label	
ERROR	missing_label	obo:omp#absent_slim	rdfs:label	
ERROR	missing_label	obo:omp#attribute_slim	rdfs:label	
ERROR	missing_label	obo:omp#cell_quality	rdfs:label	
ERROR	missing_label	obo:omp#disposition_slim	rdfs:label	
ERROR	missing_label	obo:omp#goantislim_grouping	rdfs:label	
ERROR	missing_label	obo:omp#goslim_aspergillus	rdfs:label	
ERROR	missing_label	obo:omp#goslim_candida	rdfs:label	
ERROR	missing_label	obo:omp#goslim_generic	rdfs:label	
ERROR	missing_label	obo:omp#goslim_goa	rdfs:label	
ERROR	missing_label	obo:omp#goslim_metagenomics	rdfs:label	
ERROR	missing_label	obo:omp#goslim_pir	rdfs:label	
ERROR	missing_label	obo:omp#goslim_plant	rdfs:label	
ERROR	missing_label	obo:omp#goslim_pombe	rdfs:label	
ERROR	missing_label	obo:omp#goslim_virus	rdfs:label	
ERROR	missing_label	obo:omp#goslim_yeast	rdfs:label	
ERROR	missing_label	obo:omp#gosubset_prok	rdfs:label	
ERROR	missing_label	obo:omp#hpo_slim	rdfs:label	
ERROR	missing_label	obo:omp#mf_needs_review	rdfs:label	
ERROR	missing_label	obo:omp#mpath_slim	rdfs:label	
ERROR	missing_label	obo:omp#qc_do_not_annotate	rdfs:label	
ERROR	missing_label	obo:omp#qc_do_not_manually_annotate	rdfs:label	
ERROR	missing_label	obo:omp#relational_slim	rdfs:label	
ERROR	missing_label	obo:omp#scalar_slim	rdfs:label	
ERROR	missing_label	obo:omp#value_slim	rdfs:label	
ERROR	missing_label	obo:omp#virus_checked	rdfs:label	
ERROR	missing_ontology_description	http://purl.obolibrary.org/obo/omp.owl	dc:description	
ERROR	missing_ontology_license	http://purl.obolibrary.org/obo/omp.owl	dc:license	
ERROR	missing_ontology_title	http://purl.obolibrary.org/obo/omp.owl	dc:title	
ERROR	duplicate_definition	altered fraction of non-constricted cells	IAO:0000115	population growth phenotype
ERROR	duplicate_definition	altered cell division during cell population growth	IAO:0000115	population growth phenotype
ERROR	duplicate_definition	altered cell circularity	IAO:0000115	Cell circularity is defined as (2*pi*cell area/(cell perimeter)^2).
ERROR	duplicate_definition	altered cell circularity variability	IAO:0000115	Cell circularity is defined as (2*pi*cell area/(cell perimeter)^2).
ERROR	duplicate_definition	presence of acid-fast stain	IAO:0000115	An acid-fast stain phenotype where a cell or cells that have been stained, typically with carbolfuchsin, are not easily decolorized by acid--alcohol.
ERROR	duplicate_definition	absence of acid-fast stain	IAO:0000115	An acid-fast stain phenotype where a cell or cells that have been stained, typically with carbolfuchsin, are not easily decolorized by acid--alcohol.
ERROR	duplicate_definition	decreased lethality in mice	IAO:0000115	A decreased lethality phenotype where the ability of an infectious microbe to cause death of its murine host is decreased relative to a designated control.
ERROR	duplicate_definition	increased lethality in mice	IAO:0000115	A decreased lethality phenotype where the ability of an infectious microbe to cause death of its murine host is decreased relative to a designated control.
WARN	missing_subset_declaration	obo:omp#SOFA	rdfs:subPropertyOf	
WARN	missing_subset_declaration	obo:omp#qc_do_not_annotate	rdfs:subPropertyOf	
WARN	missing_subset_declaration	obo:omp#qc_do_not_manually_annotate	rdfs:subPropertyOf	
WARN	missing_obsolete_label	plating morphology phenotype	rdfs:label	plating morphology phenotype
WARN	missing_obsolete_label	MacConkey agar phenotype	rdfs:label	MacConkey agar phenotype
WARN	missing_obsolete_label	red colony on MacConkey agar	rdfs:label	red colony on MacConkey agar
WARN	missing_obsolete_label	protein activity phenotype	rdfs:label	protein activity phenotype
WARN	missing_obsolete_label	genophore phenotype	rdfs:label	genophore phenotype
WARN	missing_obsolete_label	galactose-1-phosphate uridyl transferase activity	rdfs:label	galactose-1-phosphate uridyl transferase activity
WARN	missing_obsolete_label	increased substrate binding	rdfs:label	increased substrate binding
WARN	missing_obsolete_label	resistant to ampicillin	rdfs:label	resistant to ampicillin
WARN	missing_obsolete_label	resistant to penicillin	rdfs:label	resistant to penicillin
WARN	missing_obsolete_label	decreased cytoskeleton phenotype	rdfs:label	decreased cytoskeleton phenotype
WARN	missing_obsolete_label	abolished cytoskeleton morphology	rdfs:label	abolished cytoskeleton morphology
WARN	missing_obsolete_label	increased cytoskeleton morphology	rdfs:label	increased cytoskeleton morphology
WARN	missing_obsolete_label	abolished mutation frequency	rdfs:label	abolished mutation frequency
WARN	missing_obsolete_label	utilization of organic nitrogen phenotype	rdfs:label	utilization of organic nitrogen phenotype
WARN	missing_obsolete_label	utilization of inorganic phosphorus phenotype	rdfs:label	utilization of inorganic phosphorus phenotype
WARN	missing_obsolete_label	utilization of organic phosphorus	rdfs:label	utilization of organic phosphorus
WARN	missing_obsolete_label	antimicrobial peptide resistance phenotype	rdfs:label	antimicrobial peptide resistance phenotype
WARN	missing_obsolete_label	quality (Interim)	rdfs:label	quality (Interim)
WARN	missing_obsolete_label	abolished chemical sensitivity	rdfs:label	abolished chemical sensitivity
WARN	missing_obsolete_label	cell wall morphology phenotype	rdfs:label	cell wall morphology phenotype
WARN	missing_obsolete_label	urea derivative resistance phenotype	rdfs:label	urea derivative resistance phenotype
WARN	missing_obsolete_label	resistant to a urea derivative	rdfs:label	resistant to a urea derivative
WARN	missing_obsolete_label	not resistant to a urea derivative	rdfs:label	not resistant to a urea derivative
WARN	missing_obsolete_label	altered resistance to a urea derivative	rdfs:label	altered resistance to a urea derivative
WARN	missing_obsolete_label	increased resistance to a urea derivative	rdfs:label	increased resistance to a urea derivative
WARN	missing_obsolete_label	decreased resistance to a urea derivative	rdfs:label	decreased resistance to a urea derivative
WARN	missing_obsolete_label	abolished resistance to a urea derivative	rdfs:label	abolished resistance to a urea derivative
WARN	missing_obsolete_label	altered biological process phenotype	rdfs:label	altered biological process phenotype
WARN	missing_obsolete_label	altered population growth - duplicate term	rdfs:label	altered population growth - duplicate term
WARN	missing_obsolete_label	polyether antimicrobial resistance phenotype	rdfs:label	polyether antimicrobial resistance phenotype
WARN	missing_obsolete_label	bicyclomycin antimicrobial agent resistance phenotype	rdfs:label	bicyclomycin antimicrobial agent resistance phenotype
WARN	missing_obsolete_label	presence of resistance to bicyclomycin	rdfs:label	presence of resistance to bicyclomycin
WARN	missing_obsolete_label	absence of resistance to bicyclomycin	rdfs:label	absence of resistance to bicyclomycin
WARN	missing_obsolete_label	altered resistance to bicyclomycin	rdfs:label	altered resistance to bicyclomycin
WARN	missing_obsolete_label	decreased resistance to bicyclomycin	rdfs:label	decreased resistance to bicyclomycin
WARN	missing_obsolete_label	abolished resistance to bicyclomycin	rdfs:label	abolished resistance to bicyclomycin
WARN	missing_obsolete_label	increased resistance to bicyclomycin	rdfs:label	increased resistance to bicyclomycin
WARN	missing_obsolete_label	A22 antimicrobial agent resistance phenotype	rdfs:label	A22 antimicrobial agent resistance phenotype
WARN	missing_obsolete_label	presence of resistance to A22	rdfs:label	presence of resistance to A22
WARN	missing_obsolete_label	absence of resistance to A22	rdfs:label	absence of resistance to A22
WARN	missing_obsolete_label	increased resistance to A22	rdfs:label	increased resistance to A22
WARN	missing_obsolete_label	decreased resistance to A22	rdfs:label	decreased resistance to A22
WARN	missing_obsolete_label	abolished resistance to A22	rdfs:label	abolished resistance to A22
WARN	missing_obsolete_label	altered resistance to A22	rdfs:label	altered resistance to A22
WARN	missing_obsolete_label	presence of growth at alkaline pH	rdfs:label	presence of growth at alkaline pH
WARN	missing_obsolete_label	absence of growth at alkaline pH	rdfs:label	absence of growth at alkaline pH
WARN	missing_obsolete_label	plaque morphology phenotype	rdfs:label	plaque morphology phenotype
WARN	missing_obsolete_label	plaque size phenotype	rdfs:label	plaque size phenotype
WARN	missing_obsolete_label	altered plaque morphology phenotype	rdfs:label	altered plaque morphology phenotype
WARN	missing_obsolete_label	altered plaque size phenotype	rdfs:label	altered plaque size phenotype
WARN	missing_obsolete_label	plaque appearance phenotype	rdfs:label	plaque appearance phenotype
WARN	missing_obsolete_label	plaque size phenotype	rdfs:label	plaque size phenotype
WARN	missing_obsolete_label	bull's eye plaque appearance morphology	rdfs:label	bull's eye plaque appearance morphology
WARN	missing_obsolete_label	decreased_relative_to	rdfs:label	decreased_relative_to
WARN	missing_obsolete_label	increased_relative_to	rdfs:label	increased_relative_to
WARN	missing_definition	decreased cell surface area-to-volume ratio	IAO:0000115	
WARN	missing_definition	increased cell surface area-to-volume ratio	IAO:0000115	
WARN	missing_definition	altered cell surface area-to-volume ratio variability	IAO:0000115	
WARN	missing_definition	decreased cell surface area-to-volume ratio variability	IAO:0000115	
WARN	missing_definition	increased cell surface area-to-volume ratio variability	IAO:0000115	
WARN	missing_definition	decreased cell circularity	IAO:0000115	
WARN	missing_definition	increased cell circularity	IAO:0000115	
WARN	missing_definition	decreased cell circularity variability	IAO:0000115	
WARN	missing_definition	increased cell circularity variability	IAO:0000115	
WARN	missing_definition	altered cell aspect ratio variability	IAO:0000115	
WARN	missing_definition	decreased cell aspect ratio variability	IAO:0000115	
WARN	missing_definition	increased cell aspect ratio variability	IAO:0000115	
WARN	missing_definition	altered cell division ratio variability	IAO:0000115	
WARN	missing_definition	decreased cell division ratio variability	IAO:0000115	
WARN	missing_definition	increased cell division ratio variability	IAO:0000115	
WARN	missing_definition	altered nucleoid area	IAO:0000115	
WARN	missing_definition	decreased nucleoid area	IAO:0000115	
WARN	missing_definition	increased nucleoid area	IAO:0000115	
WARN	missing_definition	altered nucleoid area variability	IAO:0000115	
WARN	missing_definition	decreased nucleoid area variability	IAO:0000115	
WARN	missing_definition	increased nucleoid area variability	IAO:0000115	
WARN	missing_definition	altered cell population growth rate	IAO:0000115	
WARN	missing_definition	decreased cell population growth rate	IAO:0000115	
WARN	missing_definition	increased cell population growth rate	IAO:0000115	
WARN	missing_definition	cell morphology variability	IAO:0000115	
WARN	missing_definition	altered cell perimeter length	IAO:0000115	
WARN	missing_definition	decreased cell perimeter	IAO:0000115	
WARN	missing_definition	increased cell perimeter	IAO:0000115	
WARN	missing_definition	altered cell perimeter length variability	IAO:0000115	
WARN	missing_definition	decreased cell perimeter length variability	IAO:0000115	
WARN	missing_definition	increased cell perimeter length variability	IAO:0000115	
WARN	missing_definition	altered cell population phenotype	IAO:0000115	
WARN	missing_definition	altered cell population growth yield	IAO:0000115	
WARN	missing_definition	decreased cell population growth yield	IAO:0000115	
WARN	missing_definition	increased cell population growth yield	IAO:0000115	
WARN	missing_definition	decreased fraction of non-constricted cells	IAO:0000115	
WARN	missing_definition	increased fraction of non-constricted cells	IAO:0000115	
WARN	missing_definition	altered fraction of cells with one nucleoid	IAO:0000115	
WARN	missing_definition	decreased fraction of cells with one nucleoid	IAO:0000115	
WARN	missing_definition	increased fraction of cells with one nucleoid	IAO:0000115	
WARN	missing_definition	altered fraction of cells with two nucleoids	IAO:0000115	
WARN	missing_definition	decreased fraction of cells with two nucleoids	IAO:0000115	
WARN	missing_definition	increased fraction of cells with two nucleoids	IAO:0000115	
WARN	missing_definition	altered correlation between nucleoid and cell constriction during cell division	IAO:0000115	
WARN	missing_definition	decreased correlation between nucleoid and cell constriction during cell division	IAO:0000115	
WARN	missing_definition	increased correlation between nucleoid and cell constriction during cell division	IAO:0000115	
WARN	missing_definition	altered degree of nucleoid constriction at the onset of cell constriction	IAO:0000115	
WARN	missing_definition	decreased degree of nucleoid constriction at the onset of cell constriction	IAO:0000115	
WARN	missing_definition	increased degree of nucleoid constriction at the onset of cell constriction	IAO:0000115	
WARN	missing_definition	cell diameter phenotype	IAO:0000115	
WARN	missing_definition	presence of cell length variability	IAO:0000115	
WARN	missing_definition	cell area phenotype	IAO:0000115	
WARN	missing_definition	presence of cell diameter variability	IAO:0000115	
WARN	missing_definition	cell length phenotype	IAO:0000115	
WARN	missing_definition	presence of cell area variability	IAO:0000115	
WARN	missing_definition	cell perimeter length phenotype	IAO:0000115	
WARN	missing_definition	presence of cell volume variability	IAO:0000115	
WARN	missing_definition	cell surface area phenotype	IAO:0000115	
WARN	missing_definition	presence of cell surface area variability	IAO:0000115	
WARN	missing_definition	cell volume phenotype	IAO:0000115	
WARN	missing_definition	presence of cell perimeter length variability	IAO:0000115	
WARN	missing_definition	cell surface area-to-volume ratio phenotype	IAO:0000115	
WARN	missing_definition	presence of cell surface area-to-volume ratio variability	IAO:0000115	
WARN	missing_definition	presence of cell circularity variability	IAO:0000115	
WARN	missing_definition	presence of cell aspect ratio variability	IAO:0000115	
WARN	missing_definition	presence of cell division ratio variability	IAO:0000115	
WARN	missing_definition	presence of nucleoid area variability	IAO:0000115	
WARN	missing_definition	nucleoid area phenotype	IAO:0000115	
WARN	missing_definition	cell population growth yield phenotype	IAO:0000115	
WARN	missing_definition	nucleoid constriction during cell division phenotype	IAO:0000115	
WARN	missing_definition	altered nucleoid constriction during cell division	IAO:0000115	
WARN	missing_definition	correlation between nucleoid and cell constriction phenotype	IAO:0000115	
WARN	missing_definition	cell division during cell population growth phenotype	IAO:0000115	
WARN	missing_definition	altered nucleoid number phenotype	IAO:0000115	
WARN	missing_definition	timing of cell constriction phenotype	IAO:0000115	
WARN	missing_definition	timing of nucleoid separation phenotype	IAO:0000115	
WARN	missing_definition	altered timing of cell constriction	IAO:0000115	
WARN	missing_definition	altered timing of nucleoid separation	IAO:0000115	
WARN	missing_definition	decreased relative timing of cell constriction	IAO:0000115	
