Level	Rule Name	Subject	Property	Value
ERROR	duplicate_definition	altered fraction of non-constricted cells	IAO:0000115	population growth phenotype
ERROR	duplicate_definition	altered cell division during cell population growth	IAO:0000115	population growth phenotype
ERROR	duplicate_definition	altered cell circularity	IAO:0000115	Cell circularity is defined as (2*pi*cell area/(cell perimeter)^2).
ERROR	duplicate_definition	altered cell circularity variability	IAO:0000115	Cell circularity is defined as (2*pi*cell area/(cell perimeter)^2).
ERROR	duplicate_definition	presence of acid-fast stain	IAO:0000115	An acid-fast stain phenotype where a cell or cells that have been stained, typically with carbolfuchsin, are not easily decolorized by acid--alcohol.
ERROR	duplicate_definition	absence of acid-fast stain	IAO:0000115	An acid-fast stain phenotype where a cell or cells that have been stained, typically with carbolfuchsin, are not easily decolorized by acid--alcohol.
ERROR	duplicate_definition	decreased lethality in mice	IAO:0000115	A decreased lethality phenotype where the ability of an infectious microbe to cause death of its murine host is decreased relative to a designated control.
ERROR	duplicate_definition	increased lethality in mice	IAO:0000115	A decreased lethality phenotype where the ability of an infectious microbe to cause death of its murine host is decreased relative to a designated control.
ERROR	missing_label	obo:omp#Cross_product_review	rdfs:label	
ERROR	missing_label	obo:omp#SOFA	rdfs:label	
ERROR	missing_label	obo:omp#abnormal_slim	rdfs:label	
ERROR	missing_label	obo:omp#absent_slim	rdfs:label	
ERROR	missing_label	obo:omp#attribute_slim	rdfs:label	
ERROR	missing_label	obo:omp#cell_quality	rdfs:label	
ERROR	missing_label	obo:omp#disposition_slim	rdfs:label	
ERROR	missing_label	obo:omp#goantislim_grouping	rdfs:label	
ERROR	missing_label	obo:omp#goslim_aspergillus	rdfs:label	
ERROR	missing_label	obo:omp#goslim_candida	rdfs:label	
ERROR	missing_label	obo:omp#goslim_generic	rdfs:label	
ERROR	missing_label	obo:omp#goslim_goa	rdfs:label	
ERROR	missing_label	obo:omp#goslim_metagenomics	rdfs:label	
ERROR	missing_label	obo:omp#goslim_pir	rdfs:label	
ERROR	missing_label	obo:omp#goslim_plant	rdfs:label	
ERROR	missing_label	obo:omp#goslim_pombe	rdfs:label	
ERROR	missing_label	obo:omp#goslim_virus	rdfs:label	
ERROR	missing_label	obo:omp#goslim_yeast	rdfs:label	
ERROR	missing_label	obo:omp#gosubset_prok	rdfs:label	
ERROR	missing_label	obo:omp#hpo_slim	rdfs:label	
ERROR	missing_label	obo:omp#mf_needs_review	rdfs:label	
ERROR	missing_label	obo:omp#mpath_slim	rdfs:label	
ERROR	missing_label	obo:omp#qc_do_not_annotate	rdfs:label	
ERROR	missing_label	obo:omp#qc_do_not_manually_annotate	rdfs:label	
ERROR	missing_label	obo:omp#relational_slim	rdfs:label	
ERROR	missing_label	obo:omp#scalar_slim	rdfs:label	
ERROR	missing_label	obo:omp#value_slim	rdfs:label	
ERROR	missing_label	obo:omp#virus_checked	rdfs:label	
ERROR	missing_ontology_description	http://purl.obolibrary.org/obo/omp.owl	dc11:description	
ERROR	duplicate_label	presence of vegetative cell population growth	rdfs:label	presence of vegetative cell population growth
ERROR	duplicate_label	presence of vegetative cell population growth	rdfs:label	presence of vegetative cell population growth
ERROR	duplicate_label	plaque size phenotype	rdfs:label	plaque size phenotype
ERROR	duplicate_label	plaque size phenotype	rdfs:label	plaque size phenotype
ERROR	duplicate_label	plaque size phenotype	rdfs:label	plaque size phenotype
ERROR	duplicate_label	plaque morphology phenotype	rdfs:label	plaque morphology phenotype
ERROR	duplicate_label	plaque morphology phenotype	rdfs:label	plaque morphology phenotype
ERROR	duplicate_label	plaque appearance phenotype	rdfs:label	plaque appearance phenotype
ERROR	duplicate_label	plaque appearance phenotype	rdfs:label	plaque appearance phenotype
ERROR	duplicate_label	nonviable vegetative cell population	rdfs:label	nonviable vegetative cell population
ERROR	duplicate_label	nonviable vegetative cell population	rdfs:label	nonviable vegetative cell population
ERROR	duplicate_label	nonviable cell population	rdfs:label	nonviable cell population
ERROR	duplicate_label	nonviable cell population	rdfs:label	nonviable cell population
ERROR	duplicate_label	increased cellular pigment accumulation	rdfs:label	increased cellular pigment accumulation
ERROR	duplicate_label	increased cellular pigment accumulation	rdfs:label	increased cellular pigment accumulation
ERROR	duplicate_label	cell wall morphology phenotype	rdfs:label	cell wall morphology phenotype
ERROR	duplicate_label	cell wall morphology phenotype	rdfs:label	cell wall morphology phenotype
ERROR	duplicate_label	altered plaque size phenotype	rdfs:label	altered plaque size phenotype
ERROR	duplicate_label	altered plaque size phenotype	rdfs:label	altered plaque size phenotype
ERROR	duplicate_label	altered plaque morphology phenotype	rdfs:label	altered plaque morphology phenotype
ERROR	duplicate_label	altered plaque morphology phenotype	rdfs:label	altered plaque morphology phenotype
ERROR	duplicate_label	altered actin cytoskeleton	rdfs:label	altered actin cytoskeleton
ERROR	duplicate_label	altered actin cytoskeleton	rdfs:label	altered actin cytoskeleton
ERROR	missing_ontology_license	http://purl.obolibrary.org/obo/omp.owl	dc:license	
ERROR	missing_ontology_title	http://purl.obolibrary.org/obo/omp.owl	dc11:title	
WARN	annotation_whitespace	decreased resistance to dessication stress	oboInOwl:hasRelatedSynonym	increased dessication sensitivity 
WARN	annotation_whitespace	decreased resistance to freeze/thawing stress	oboInOwl:hasRelatedSynonym	decreased freeze/thaw sensitivity. 
WARN	annotation_whitespace	decreased resistance to x-ray radiation	oboInOwl:hasNarrowSynonym	increased x-ray sensitivity 
WARN	annotation_whitespace	increased resistance to UV radiation	oboInOwl:hasRelatedSynonym	decreased UV sensitivity 
WARN	annotation_whitespace	decreased resistance to UV radiation	oboInOwl:hasRelatedSynonym	increased UV sensitivity 
WARN	annotation_whitespace	cell cycle phenotype	oboInOwl:hasExactSynonym	cell division cycle 
WARN	annotation_whitespace	abolished endocytosis	oboInOwl:hasNarrowSynonym	abolished endocytosis during vegetative growth 
WARN	annotation_whitespace	delayed onset of endocytosis	oboInOwl:hasRelatedSynonym	delayed onset of endocytosis during vegetative growth 
WARN	annotation_whitespace	carbon source utilization phenotype	oboInOwl:hasNarrowSynonym	succinate 
WARN	annotation_whitespace	quinolone resistance phenotype	oboInOwl:hasBroadSynonym	quinolines 
WARN	annotation_whitespace	presence of outer membrane vesicles	oboInOwl:hasExactSynonym	vesiculation 
WARN	annotation_whitespace	inorganic nitrogen source utilization phenotype	oboInOwl:hasNarrowSynonym	nitrate utilization, phenotype 
WARN	annotation_whitespace	phototrophic phenotype	oboInOwl:hasRelatedSynonym	phototroph 
WARN	annotation_whitespace	decreased resistance to a chemical	oboInOwl:hasExactSynonym	 increased sensitivity to a chemical
WARN	annotation_whitespace	attached lifestyle phenotype	oboInOwl:hasExactSynonym	anchored lifestyle phenotype 
WARN	missing_definition	decreased cell surface area-to-volume ratio	IAO:0000115	
WARN	missing_definition	increased cell surface area-to-volume ratio	IAO:0000115	
WARN	missing_definition	altered cell surface area-to-volume ratio variability	IAO:0000115	
WARN	missing_definition	decreased cell surface area-to-volume ratio variability	IAO:0000115	
WARN	missing_definition	increased cell surface area-to-volume ratio variability	IAO:0000115	
WARN	missing_definition	decreased cell circularity	IAO:0000115	
WARN	missing_definition	increased cell circularity	IAO:0000115	
WARN	missing_definition	decreased cell circularity variability	IAO:0000115	
WARN	missing_definition	increased cell circularity variability	IAO:0000115	
WARN	missing_definition	altered cell aspect ratio variability	IAO:0000115	
WARN	missing_definition	decreased cell aspect ratio variability	IAO:0000115	
WARN	missing_definition	increased cell aspect ratio variability	IAO:0000115	
WARN	missing_definition	altered cell division ratio variability	IAO:0000115	
WARN	missing_definition	decreased cell division ratio variability	IAO:0000115	
WARN	missing_definition	increased cell division ratio variability	IAO:0000115	
WARN	missing_definition	altered nucleoid area	IAO:0000115	
WARN	missing_definition	decreased nucleoid area	IAO:0000115	
WARN	missing_definition	increased nucleoid area	IAO:0000115	
WARN	missing_definition	altered nucleoid area variability	IAO:0000115	
WARN	missing_definition	decreased nucleoid area variability	IAO:0000115	
WARN	missing_definition	increased nucleoid area variability	IAO:0000115	
WARN	missing_definition	altered cell population growth rate	IAO:0000115	
WARN	missing_definition	decreased cell population growth rate	IAO:0000115	
WARN	missing_definition	increased cell population growth rate	IAO:0000115	
WARN	missing_definition	cell morphology variability	IAO:0000115	
WARN	missing_definition	altered cell perimeter length	IAO:0000115	
WARN	missing_definition	decreased cell perimeter	IAO:0000115	
WARN	missing_definition	increased cell perimeter	IAO:0000115	
WARN	missing_definition	altered cell perimeter length variability	IAO:0000115	
WARN	missing_definition	decreased cell perimeter length variability	IAO:0000115	
WARN	missing_definition	increased cell perimeter length variability	IAO:0000115	
WARN	missing_definition	altered cell population phenotype	IAO:0000115	
WARN	missing_definition	altered cell population growth yield	IAO:0000115	
WARN	missing_definition	decreased cell population growth yield	IAO:0000115	
WARN	missing_definition	increased cell population growth yield	IAO:0000115	
WARN	missing_definition	decreased fraction of non-constricted cells	IAO:0000115	
WARN	missing_definition	increased fraction of non-constricted cells	IAO:0000115	
WARN	missing_definition	altered fraction of cells with one nucleoid	IAO:0000115	
WARN	missing_definition	decreased fraction of cells with one nucleoid	IAO:0000115	
WARN	missing_definition	increased fraction of cells with one nucleoid	IAO:0000115	
WARN	missing_definition	altered fraction of cells with two nucleoids	IAO:0000115	
WARN	missing_definition	decreased fraction of cells with two nucleoids	IAO:0000115	
WARN	missing_definition	increased fraction of cells with two nucleoids	IAO:0000115	
WARN	missing_definition	altered correlation between nucleoid and cell constriction during cell division	IAO:0000115	
WARN	missing_definition	decreased correlation between nucleoid and cell constriction during cell division	IAO:0000115	
WARN	missing_definition	increased correlation between nucleoid and cell constriction during cell division	IAO:0000115	
WARN	missing_definition	altered degree of nucleoid constriction at the onset of cell constriction	IAO:0000115	
WARN	missing_definition	decreased degree of nucleoid constriction at the onset of cell constriction	IAO:0000115	
WARN	missing_definition	increased degree of nucleoid constriction at the onset of cell constriction	IAO:0000115	
WARN	missing_definition	cell diameter phenotype	IAO:0000115	
WARN	missing_definition	presence of cell length variability	IAO:0000115	
WARN	missing_definition	cell area phenotype	IAO:0000115	
WARN	missing_definition	presence of cell diameter variability	IAO:0000115	
WARN	missing_definition	cell length phenotype	IAO:0000115	
WARN	missing_definition	presence of cell area variability	IAO:0000115	
WARN	missing_definition	cell perimeter length phenotype	IAO:0000115	
WARN	missing_definition	presence of cell volume variability	IAO:0000115	
WARN	missing_definition	cell surface area phenotype	IAO:0000115	
WARN	missing_definition	presence of cell surface area variability	IAO:0000115	
WARN	missing_definition	cell volume phenotype	IAO:0000115	
WARN	missing_definition	presence of cell perimeter length variability	IAO:0000115	
WARN	missing_definition	cell surface area-to-volume ratio phenotype	IAO:0000115	
WARN	missing_definition	presence of cell surface area-to-volume ratio variability	IAO:0000115	
WARN	missing_definition	presence of cell circularity variability	IAO:0000115	
WARN	missing_definition	presence of cell aspect ratio variability	IAO:0000115	
WARN	missing_definition	presence of cell division ratio variability	IAO:0000115	
WARN	missing_definition	presence of nucleoid area variability	IAO:0000115	
WARN	missing_definition	nucleoid area phenotype	IAO:0000115	
WARN	missing_definition	cell population growth yield phenotype	IAO:0000115	
WARN	missing_definition	nucleoid constriction during cell division phenotype	IAO:0000115	
WARN	missing_definition	altered nucleoid constriction during cell division	IAO:0000115	
WARN	missing_definition	correlation between nucleoid and cell constriction phenotype	IAO:0000115	
WARN	missing_definition	cell division during cell population growth phenotype	IAO:0000115	
WARN	missing_definition	altered nucleoid number phenotype	IAO:0000115	
WARN	missing_definition	timing of cell constriction phenotype	IAO:0000115	
WARN	missing_definition	timing of nucleoid separation phenotype	IAO:0000115	
WARN	missing_definition	altered timing of cell constriction	IAO:0000115	
WARN	missing_definition	altered timing of nucleoid separation	IAO:0000115	
WARN	missing_definition	decreased relative timing of cell constriction	IAO:0000115	
WARN	missing_definition	increased relative timing of cell constriction	IAO:0000115	
WARN	missing_definition	cell length variability phenotype	IAO:0000115	
WARN	missing_definition	cell diameter variability phenotype	IAO:0000115	
WARN	missing_definition	cell area variability phenotype	IAO:0000115	
WARN	missing_definition	cell volume variability phenotype	IAO:0000115	
WARN	missing_definition	cell surface area variability phenotype	IAO:0000115	
WARN	missing_definition	cell perimeter length variability phenotype	IAO:0000115	
WARN	missing_definition	cell surface area-to-volume ratio variability phenotype	IAO:0000115	
WARN	missing_definition	cell circularity variability phenotype	IAO:0000115	
WARN	missing_definition	cell aspect ratio variability phenotype	IAO:0000115	
WARN	missing_definition	nucleoid area variability phenotype	IAO:0000115	
WARN	missing_definition	cell division ratio variability phenotype	IAO:0000115	
WARN	missing_definition	internalization by macrophage phenotype	IAO:0000115	
WARN	missing_definition	presence of internalization by macrophage	IAO:0000115	
WARN	missing_definition	absence of internalization by macrophage	IAO:0000115	
WARN	missing_definition	altered internalization by macrophage	IAO:0000115	
WARN	missing_definition	increased internalization by macrophage	IAO:0000115	
WARN	missing_definition	decreased internalization by macrophage	IAO:0000115	
WARN	missing_definition	abolished internalization by macrophage	IAO:0000115	
WARN	missing_definition	absence of acid tolerance response	IAO:0000115	
WARN	missing_definition	altered acid tolerance response	IAO:0000115	
WARN	missing_definition	presence of acid tolerance response	IAO:0000115	
WARN	missing_definition	decreased acid tolerance response	IAO:0000115	
WARN	missing_definition	increased acid tolerance response	IAO:0000115	
WARN	missing_definition	abolished acid tolerance response	IAO:0000115	
WARN	missing_definition	absence of cell-cell self recognition	IAO:0000115	
WARN	missing_definition	altered cell-cell self recognition	IAO:0000115	
WARN	missing_definition	increased cell-cell self recognition	IAO:0000115	
WARN	missing_definition	decreased cell-cell self recognition	IAO:0000115	
WARN	missing_definition	abolished cell-cell self recognition	IAO:0000115	
WARN	missing_definition	presence of transcription of gene or operon	IAO:0000115	
WARN	missing_definition	absence of transcription of gene or operon	IAO:0000115	
WARN	missing_definition	response to oxidative stress phenotype	IAO:0000115	
WARN	missing_definition	viable but nonculturable cell	IAO:0000115	
WARN	missing_definition	increased mucoidy	IAO:0000115	
WARN	missing_definition	absence of survival in macrophage	IAO:0000115	
WARN	missing_definition	altered survival in macrophage	IAO:0000115	
WARN	missing_definition	survival in macrophage phenotype	IAO:0000115	
WARN	missing_definition	clamp connection morphology phenotype	IAO:0000115	
WARN	missing_definition	resistant to mitomycin	IAO:0000115	
WARN	missing_definition	not resistant to mitomycin	IAO:0000115	
WARN	missing_definition	level of substance in cell phenotype	IAO:0000115	
WARN	missing_definition	presence of cellular reactive oxygen species	IAO:0000115	
